year,session,title,abstract,authors,doi
2017,Supporting Low Resource Communities,Supporting Community Health Workers in India through Voice- and Web-Based Feedback,"Our research aims to support community health workers (CHWs) in low-resource settings by providing them with personalized information regarding their work. This information is delivered through a combination of voice- and web-based feedback that is derived from data already collected by CHWs. We describe the in situ participatory design approach used to create usable and appropriate feedback for low-literate CHWs and present usage data from a 12-month study with 71 CHWs in India. We show how the system supported and motivated CHWs, and how they used both the web- and voice-based systems, and each of the visualizations, for different reasons. We also show that the comparative feedback provided by the system introduced elements of competition that discouraged some CHWs while motivating others. Taken together, our findings suggest that providing personalized voice- and web-based feedback could be an effective way to support and motivate CHWs in low-resource settings.","Brian DeRenzi,Nicola Dell,Jeremy Wacksman,Scott Lee,Neal Lesh",https://doi.org/10.1145/3025453.3025514
2017,Big Data Intelligent Visualization Systems,"Trust, but Verify: Optimistic Visualizations of Approximate Queries for Exploring Big Data","Analysts need interactive speed for exploratory analysis, but big data systems are often slow. With sampling, data systems can produce approximate answers fast enough for exploratory visualization, at the cost of accuracy and trust. We propose optimistic visualization, which approaches these issues from a user experience perspective. This method lets analysts explore approximate results interactively, and provides a way to detect and recover from errors later. Pangloss implements these ideas. We discuss design issues raised by optimistic visualization systems. We test this concept with five expert visualizers in a laboratory study and three case studies at Microsoft. Analysts reported that they felt more confident in their results, and used optimistic visualization to check that their preliminary results were correct.","Dominik Moritz,Danyel Fisher,Bolin Ding,Chi Wang",https://doi.org/10.1145/3025453.3025456
2017,Big Data Intelligent Visualization Systems,iSphere: Focus+Context Sphere Visualization for Interactive Large Graph Exploration,"Interactive exploration plays a critical role in large graph visualization. Existing techniques, such as zoom-and-pan on a 2D plane and hyperbolic browser facilitate large graph exploration by showing both the details of a focal area and its surrounding context that guides the exploration process. However, existing techniques for large graph exploration are limited in either providing too little context or presenting graphs with too much distortion. In this paper, we propose a novel focus+context technique, iSphere, to address the limitation. iSphere maps a large graph onto a Riemann Sphere that better preserves graph structures and shows greater context information. We conduct extensive experiment studies on different graph exploration tasks under various conditions. The results show that iSphere performs the best in task completion time compared to the baseline techniques in link and path exploration tasks. This research also contributes to understanding large graph exploration on small screens.","Fan Du,Nan Cao,Yu-Ru Lin,Panpan Xu,Hanghang Tong",https://doi.org/10.1145/3025453.3025628
2017,Designing Gaze-based Gestures and Features,Supporting Making Fixations and the Effect on Gaze Gesture Performance,"Gaze gestures are deliberate patterns of eye movements that can be used to invoke commands. These are less reliant on accurate measurement and calibration than other gaze-based interaction techniques. These may be used with wearable displays fitted with eye tracking capability, or as part of an assistive technology. The visual stimuli in the information on the display that can act as fixation targets may or may not be sparse and will vary over time. The paper describes an experiment to investigate how the amount of information provided on a display to assist making fixations affects gaze gesture performance. The impact of providing visualization guides and small fixation targets on the time to complete gestures and error rates is presented. The number and durations of fixations made during gesture completion is used to explain differences in performance as a result of practice and direction of eye movement.","Howell Istance,Aulikki I. Hyrskykari",https://doi.org/10.1145/3025453.3025920
2017,Online Content,PersaLog: Personalization of News Article Content,"Content personalization automatically modifying text and multimedia features within articles based on the reader's individual features'is evolving as a new form of journalism. Informed by constraints articulated through a survey of journalists, we have implemented PersaLog, a novel system for creating personalized content (e.g., text and interactive visualizations). Because crafting, and validating, personalized content can be challenging to scale across articles (unlike feed personalization), we offer a simple Domain Specific Language (DSL), and editing environment, to support this task. PersaLog is particularly designed to support the personalization of existing text and visualizations. Our work provides guidelines for personalization as well as a system that allows for both subtle and dramatic personalization-driven content changes. We validate PersaLog using case and lab studies.","Eytan Adar,Carolyn Gearig,Ayshwarya Balasubramanian,Jessica Hullman",https://doi.org/10.1145/3025453.3025631
2017,Technology Enabled Commerce,Why Users Disintermediate Peer-to-Peer Marketplaces,"This paper reports on a study of the prevalence of and possible reasons for peer-to-peer transaction marketplace (P2PM) users turning to out-of-market (OOM) transactions after finding transaction partners within a P2P system. We surveyed 97 P2PM users and interviewed 22 of 58 who reported going OOM. We did not find any evidence of predisposing personality factors for OOM activity; instead, it seems to be a rational response to circumstances, with a variety of situationally rational motivations at play, such as liking the transaction partner and trusting that good quality repeat transactions will occur in the future.","Victoria Bellotti,Dan Turner,Kamila Demkova,Alexander Ambard,Amanda Waterman",https://doi.org/10.1145/3025453.3025815
2017,Civic Engagement,Revisiting The American Voter on Twitter,"The American Voter - a seminal work in political science - uncovered the multifaceted nature of voting behavior which has been corroborated in electoral research for decades since. In this paper, we leverage The American Voter as an analysis framework in the realm of computational political science, employing the factors of party, personality, and policy to structure the analysis of public discourse on online social media during the 2016 U.S. presidential primaries. Our analysis of 50 million tweets reveals the continuing importance of these three factors; our understanding is also enriched by the application of sentiment analysis techniques. The overwhelmingly negative sentiment of conversations surrounding 10 major presidential candidates reveals more ""crosstalk"" from Democratic leaning users towards Republican candidates, and less vice-versa. We uncover the lack of moderation as the most discussed personality dimension during this campaign season, as the political field becomes more extreme - Clinton and Rubio are perceived as moderate, while Trump, Sanders, and Cruz are not. While the most discussed issues are foreign policy and immigration, Republicans tweet more about abortion than Democrats who tweet more about gay rights than Republicans. Finally, we illustrate the importance of multifaceted political discourse analysis by applying regression to quantify the impact of party, personality, and policy on national polls.","Huyen T. Le,G. R. Boynton,Yelena Mejova,Zubair Shafiq,Padmini Srinivasan",https://doi.org/10.1145/3025453.3025543
2017,Cross Device Interaction,"Is Two Enough?: ! Studying Benefits, Barriers, and Biases of Multi-Tablet Use for Collaborative Visualization","A sizable part of HCI research on cross-device interaction is driven by the vision of users conducting complex knowledge work seamlessly across multiple mobile devices. This is based on the Weiserian assumption that people will be inclined to distribute their work across multiple ``pads' if such are available. We observed that this is not the reality today, even when devices were in abundance. We present a study with 24 participants in 12 dyads completing a collaborative visualization task with up to six tablets. They could choose between three different visualization types to answer questions about economic data. Tasks were designed to afford simultaneous use of tablets, either with linked or independent views. We found that users typically utilized only one tablet per user. A quantitative and qualitative analysis revealed a ``legacy bias' that introduced barriers for using more tablets and reduced the overall benefit of multi-device visualization.","Thomas Plank,Hans-Christian Jetter,Roman Rädle,Clemens N. Klokmose,Thomas Luger,Harald Reiterer",https://doi.org/10.1145/3025453.3025537
2017,Online and On-the-go,How Busy Are You?: Predicting the Interruptibility Intensity of Mobile Users,"Smartphones frequently notify users about newly available messages or other notifications. It can be very disruptive when these notifications interrupt users while they are busy. Our work here is based on the observation that people usually exhibit different levels of busyness at different contexts. This means that classifying users' interruptibility as a binary status, interruptible or not interruptible, is not sufficient to accurately measure their availability towards smartphone interruptions. In this paper, we propose, implement and evaluate a two-stage hierarchical model to predict people's interruptibility intensity. Our work is the first to introduce personality traits into interruptibility prediction model, and we found that personality data improves the prediction significantly. Our model bootstraps the prediction with similar people's data, and provides a good initial prediction for users whose individual models have not been trained on their own data yet. Overall prediction accuracy of our model can reach 66.1%.","Fengpeng Yuan,Xianyi Gao,Janne Lindqvist",https://doi.org/10.1145/3025453.3025946
2017,Visualization for the People,Showing People Behind Data: Does Anthropomorphizing Visualizations Elicit More Empathy for Human Rights Data?,"We investigate the impact of using anthropomorphized data graphics over standard charts on viewers' empathy for, and prosocial behavior toward suffering populations, in the context of human rights narratives. We present a series of experiments conducted on Amazon Mechanical Turk, in which we compare various forms of anthropomorphized data graphics-ranging from a single human figure that ""fills up"" to show proportional data, to separated groups of individual human beings-with a standard chart baseline. Each experiment uses two carefully crafted human rights data-driven stories to present the graphics. Contrary to our expectations, we consistently find that anthropomorphized data graphics and standard charts have very similar effects on empathy and prosocial behavior.","Jeremy Boy,Anshul Vikram Pandey,John Emerson,Margaret Satterthwaite,Oded Nov,Enrico Bertini",https://doi.org/10.1145/3025453.3025512
2017,Visualization for the People,Narratives in Crowdsourced Evaluation of Visualizations: A Double-Edged Sword?,"We explore the effects of providing task context when evaluating visualization tools using crowdsourcing. We gave crowdsource workers i) abstract information visualization tasks without any context, ii) tasks where we added semantics to the dataset, and iii) tasks with two types of backstory narratives: an analytic narrative and a decision-making narrative. Contrary to our expectations, we did not find evidence that adding data semantics increases accuracy, and further found that our backstory narratives can even decrease accuracy. Adding dataset semantics can however increase attention and provide subjective benefits in terms of confidence, perceived easiness, task enjoyability and perceived usefulness of the visualization. Nevertheless, our backstory narratives did not appear to provide additional subjective benefits. These preliminary findings suggest that narratives may have complex and unanticipated effects, calling for more studies in this area.","Evanthia Dimara,Anastasia Bezerianos,Pierre Dragicevic",https://doi.org/10.1145/3025453.3025870
2017,Visualization for the People,Visualization Literacy at Elementary School,"This work advances our understanding of children's visualization literacy, and aims to improve it through a novel approach for teaching visualization at elementary school. We first contribute an analysis of data graphics and activities employed in grade K to 4 educational materials, and the results of a survey conducted with 16 elementary school teachers. We find that visualization education could benefit from integrating pedagogical strategies for teaching abstract concepts with established interactive visualization techniques. Building on these insights, we develop and study design principles for novel interactive teaching material aimed at increasing children's visualization literacy. We specifically contribute C'est La Vis, an online platform for teachers and students to respectively teach and learn about pictographs and bar charts, and report on our initial observations of its use in grades K and 2.","Basak Alper,Nathalie Henry Riche,Fanny Chevalier,Jeremy Boy,Metin Sezgin",https://doi.org/10.1145/3025453.3025877
2017,Helping Software Developers,Improving Communication Between Pair Programmers Using Shared Gaze Awareness,"Remote collaboration can be more difficult than collocated collaboration for a number of reasons, including the inability to easily determine what your collaborator is looking at. This impedes a pair's ability to efficiently communicate about on-screen locations and makes synchronous coordination difficult. We designed a novel gaze visualization for remote pair programmers which shows where in the code their partner is currently looking, and changes color when they are looking at the same thing. Our design is unobtrusive, and transparently depicts the imprecision inherent in eye tracking technology. We evaluated our design with an experiment in which pair programmers worked remotely on code refactoring tasks. Our results show that with the visualization, pairs spent a greater proportion of their time concurrently looking at the same code locations. Pairs communicated using a larger ratio of implicit to explicit references, and were faster and more successful at responding to those references.","Sarah D'Angelo,Andrew Begel",https://doi.org/10.1145/3025453.3025573
2017,Presentation in Online Communities,Relational Distancing and Termination between Online Friends: An Application of the Investment Model,"This research examined the relational maintenance versus termination of online friendships in Facebook. Guided by Rusbult's [33] investment model (IM), the study constructed a model to examine 55 matched pairs of Facebook friends consisting of one ""primary user"" and one ""annoyer."" Results indicated that primary users' judgments of relational satisfaction with annoyers were influenced by annoyers' narcissistic personality and their overall propensity for posting overly self-focused content. Commitment affected primary users' use of both passive ""unfollowing"" and active ""unfriending"" in response to annoyers' behavior. Decisions to maintain or terminate online friendships are related to judgments and actions of both partners. Overall, these results emphasize the dyadic nature of relational maintenance and termination processes in online environments, and the importance of studying them as such.","Christopher J. Carpenter,Stephanie Tom Tong",https://doi.org/10.1145/3025453.3026026
2018,Paper Presentations,When David Meets Goliath: Combining Smartwatches with a Large Vertical Display for Visual Data Exploration,"We explore the combination of smartwatches and a large interactive display to support visual data analysis. These two extremes of interactive surfaces are increasingly popular, but feature different characteristics-display and input modalities, personal/public use, performance, and portability. In this paper, we first identify possible roles for both devices and the interplay between them through an example scenario. We then propose a conceptual framework to enable analysts to explore data items, track interaction histories, and alter visualization configurations through mechanisms using both devices in combination. We validate an implementation of our framework through a formative evaluation and a user study. The results show that this device combination, compared to just a large display, allows users to develop complex insights more fluidly by leveraging the roles of the two devices. Finally, we report on the interaction patterns and interplay between the devices for visual exploration as observed during our study.","Tom Horak,Sriram Karthik Badam,Niklas Elmqvist,Raimund Dachselt",https://doi.org/10.1145/3173574.3173593
2018,Paper Presentations,Exploration and Explanation in Computational Notebooks,"Computational notebooks combine code, visualizations, and text in a single document. Researchers, data analysts, and even journalists are rapidly adopting this new medium. We present three studies of how they are using notebooks to document and share exploratory data analyses. In the first, we analyzed over 1 million computational notebooks on GitHub, finding that one in four had no explanatory text but consisted entirely of visualizations or code. In a second study, we examined over 200 academic computational notebooks, finding that although the vast majority described methods, only a minority discussed reasoning or results. In a third study, we interviewed 15 academic data analysts, finding that most considered computational notebooks personal, exploratory, and messy. Importantly, they typically used other media to share analyses. These studies demonstrate a tension between exploration and explanation in constructing and sharing computational notebooks. We conclude with opportunities to encourage explanation in computational media without hindering exploration.","Adam Rule,Aurélien Tabard,James D. Hollan",https://doi.org/10.1145/3173574.3173606
2018,Paper Presentations,Design Patterns for Data Comics,"Data comics for data-driven storytelling are inspired by the visual language of comics and aim to communicate insights in data through visualizations. While comics are widely known, few examples of data comics exist and there has not been any structured analysis nor guidance for their creation. We introduce data-comic design-patterns, each describing a set of panels with a specific narrative purpose, that allow for rapid storyboarding of data comics while showcasing their expressive potential. Our patterns are derived from i) analyzing common patterns in infographics, datavideos, and existing data comics, ii) our experiences creating data comics for different scenarios. Our patterns demonstrate how data comics allow an author to combine the best of both worlds: spatial layout and overview from infographics as well as linearity and narration from videos and presentations.","Benjamin Bach,Zezhong Wang,Matteo Farinella,Dave Murray-Rust,Nathalie Henry Riche",https://doi.org/10.1145/3173574.3173612
2018,Paper Presentations,"Clusters, Trends, and Outliers: How Immersive Technologies Can Facilitate the Collaborative Analysis of Multidimensional Data","Immersive technologies such as augmented reality devices are opening up a new design space for the visual analysis of data. This paper studies the potential of an augmented reality environment for the purpose of collaborative analysis of multidimensional, abstract data. We present ART, a collaborative analysis tool to visualize multidimensional data in augmented reality using an interactive, 3D parallel coordinates visualization. The visualization is anchored to a touch-sensitive tabletop, benefiting from well-established interaction techniques. The results of group-based, expert walkthroughs show that ART can facilitate immersion in the data, a fluid analysis process, and collaboration. Based on the results, we provide a set of guidelines and discuss future research areas to foster the development of immersive technologies as tools for the collaborative analysis of multidimensional data.","Simon Butscher,Sebastian Hubenschmid,Jens Müller,Johannes Fuchs,Harald Reiterer",https://doi.org/10.1145/3173574.3173664
2018,Paper Presentations,Effects of Individual Differences in Blocking Workplace Distractions,"Information workers are experiencing ever-increasing online distractions in the workplace, and software to block distractions is becoming more popular. We conducted an exploratory field study with 32 information workers in their workplace using software to block online distractions for one week. We discovered that with online distractions blocked, participants assessed their focus and productivity to be significantly higher. Those who benefited most were those who reported being less in control of their work, associated with personality traits of lower Conscientiousness and Lack of Perseverence. Unexpectedly, those reporting higher control of work experienced a cost of higher workload with online distractions blocked. Those who reported the greatest increase in focus with distractions blocked were those who were more susceptible to social media distractions. Without distractions, people with higher control of work worked longer stretches without physical breaks, with consequently higher stress. We present design recommendations to promote focus for our observed coping behaviors.","Gloria Mark,Mary Czerwinski,Shamsi T. Iqbal",https://doi.org/10.1145/3173574.3173666
2018,Paper Presentations,Understanding Older Users' Acceptance of Wearable Interfaces for Sensor-based Fall Risk Assessment,"Algorithms processing data from wearable sensors promise to more accurately predict risks of falling -- a significant concern for older adults. Substantial engineering work is dedicated to increasing the prediction accuracy of these algorithms; yet fewer efforts are dedicated to better engaging users through interactive visualizations in decision-making using these data. We present an investigation of the acceptance of a sensor-based fall risk assessment wearable device. A participatory design was employed to develop a mobile interface providing visualizations of sensor data and algorithmic assessments of fall risks. We then investigated the acceptance of this interface and its potential to motivate behavioural changes through a field deployment, which suggested that the interface and its belt-mounted wearable sensors are perceived as usable. We also found that providing contextual information for fall risk estimation combined with relevant practical fall prevention instructions may facilitate the acceptance of such technologies, potentially leading to behaviour change.","Alan Yusheng Wu,Cosmin Munteanu",https://doi.org/10.1145/3173574.3173693
2018,Paper Presentations,Data Illustrator: Augmenting Vector Design Tools with Lazy Data Binding for Expressive Visualization Authoring,"Building graphical user interfaces for visualization authoring is challenging as one must reconcile the tension between flexible graphics manipulation and procedural visualization generation based on a graphical grammar or declarative languages. To better support designers' workflows and practices, we propose Data Illustrator, a novel visualization framework. In our approach, all visualizations are initially vector graphics; data binding is applied when necessary and only constrains interactive manipulation to that data bound property. The framework augments graphic design tools with new concepts and operators, and describes the structure and generation of a variety of visualizations. Based on the framework, we design and implement a visualization authoring system. The system extends interaction techniques in modern vector design tools for direct manipulation of visualization configurations and parameters. We demonstrate the expressive power of our approach through a variety of examples. A qualitative study shows that designers can use our framework to compose visualizations.","Zhicheng Liu,John Thompson,Alan Wilson,Mira Dontcheva,James Delorey,Sam Grigg,Bernard Kerr,John Stasko",https://doi.org/10.1145/3173574.3173697
