year,session,title,abstract,authors,doi
2009,Design methods,PrintMarmoset: redesigning the print button for sustainability,"In this paper, we discuss some unique challenges of sustainable interaction design (SID) and present our work that aims to reduce paper waste from web printing. We conducted a two-month field study of current behaviors and attitudes around printing, and the results confirmed the affordances of paper, but also revealed many problems associated with printing web content. We then designed and implemented a browser extension, PrintMarmoset, that targets these problems while simultaneously addressing user needs and environmental responsibility. It allows users to effortless select or remove web content for printing. We have also incorporated a data sharing mechanism into our solution to assist in the adoption of the tool and created visualizations to encourage user reflection and exploration.","Jun Xiao,Jian Fan",https://doi.org/10.1145/1518701.1518720
2009,Learning challenges,Session details: Learning challenges,"One hallmark difficulty of children with Autism Spectrum Disorder (ASD) centers on communication and speech. Research into computer visualizations of voice has been shown to influence conversational patterns and allow users to reflect upon their speech. In this paper, we present the Spoken Impact Project (SIP), an effort to examine the effect of audio and visual feedback on vocalizations in low-functioning children with ASD by providing them with additional means of understanding and exploring their voice. This research spans over 12 months, including the creation of multiple software packages and detailed analysis of more than 20 hours of experimental video. SIP demonstrates the potential of computer generated audio and visual feedback to encourage vocalizations of children with ASD.","Julie Kientz,Joshua Hailpern,Karrie Karahalios,James Halle",https://doi.org/10.1145/1518701.1518774
2009,Looking at videos,What's next?: emergent storytelling from video collection,"In the world of visual storytelling, narrative development relies on a particular temporal ordering of shots and sequences and scenes. Rarely is this ordering cast in stone. Rather, the particular ordering of a story reflects a myriad of interdependent decisions about the interplay of structure, narrative arc and character development. For storytellers, particularly those developing their narratives from large documentary archives, it would be helpful to have a visualization system partnered with them to present suggestions for the most compelling story path. We present Storied Navigation, a video editing system that helps authors compose a sequence of scenes that tell a story, by selecting from a corpus of annotated clips. The clips are annotated in unrestricted natural language. Authors can also type a story in unrestricted English, and the system finds possibilities for clips that best match high-level elements of the story. Beyond simple keyword matching, these elements can include the characters, emotions, themes, and story structure. Authors can also interactively replace existing scenes or predict the next scene to continue a story, based on these characteristics. Storied Navigation gives the author the feel of brainstorming about the story rather than simply editing the media.","Edward Yu-Te Shen,Henry Lieberman,Glorianna Davenport",https://doi.org/10.1145/1518701.1518825
2009,Techniques for mobile interaction,Unravelling seams: improving mobile gesture recognition with visual feedback techniques,"Gesture recognition is emerging as an engaging interaction technique in mobile scenarios, and high recognition rates promote user acceptance. Several factors influence recognition rates including the nature of the gesture set and the suitability of the gesture recognition algorithm. This work explores how seamfulness in gesture stroke visualization affects recognition rates. We present the results of a user evaluation of a gesture recognition system that shows that raw (seamful) visualization of low-delity gesture stroke data has recognition rates comparable to no feedback. Providing filtered (seamless) stroke visualization to the user, while retaining the un-filtered input data for recognition, resulted in a 34.9% improvement in gesture recognition rate over raw stroke data. The results provide insights into the broader design space of seamful design, and identifies areas where seamlessness is advantageous.","Sven Kratz,Rafael Ballagas",https://doi.org/10.1145/1518701.1518844
2009,Visualization 1,Session details: Visualization 1,"People's ability to accurately locate target objects in images is severely affected by the prevalence of the sought objects. This negative effect greatly impacts critical real world tasks, such as baggage screening and cell slide pathology, in which target objects are rare. We present three novel image presentation techniques that are designed to improve visual search. Our techniques rely on the images being broken into image segments, which are then recombined or displayed in novel ways. The techniques and their underlying design reasoning are described in detail, and three experiments are presented that provide initial evidence that these techniques lead to better search performance in a simulated cell slide pathology task.","Maneesh Agrawala,Clifton Forlines,Ravin Balakrishnan",https://doi.org/10.1145/1518701.1518868
2009,Visualization 1,SiteLens: situated visualization techniques for urban site visits,"Urban designers and urban planners often conduct site visits prior to a design activity to search for patterns or better understand existing conditions. We introduce SiteLens, an experimental system and set of techniques for supporting site visits by visualizing relevant virtual data directly in the context of the physical site, which we call situated visualization. We address alternative visualization representations and techniques for data collection, curation, discovery, comparison, manipulation, and provenance. A real use scenario is presented and two iterations of evaluation with faculty and students from the Columbia University Graduate School of Architecture, Planning and Preservation provide directions and insight for further investigation.","Sean White,Steven Feiner",https://doi.org/10.1145/1518701.1518871
2009,"Using tabletops for education, science, and media",WeSpace: the design development and deployment of a walk-up and share multi-surface visual collaboration system,"We present WeSpace -- a collaborative work space that integrates a large data wall with a multi-user multi-touch table. WeSpace has been developed for a population of scientists who frequently meet in small groups for data exploration and visualization. It provides a low overhead walk-up and share environment for users with their own personal applications and laptops. We present our year-long effort from initial ethnographic studies, to iterations of design, development and user testing, to the current experiences of these scientists carrying out their collaborative research in the WeSpace. We shed light on the utility, the value of the multi-touch table, the manifestation, usage patterns and the changes in their workflow that WeSpace has brought about.","Daniel Wigdor,Hao Jiang,Clifton Forlines,Michelle Borkin,Chia Shen",https://doi.org/10.1145/1518701.1518886
2009,Visualization 2,Session details: Visualization 2,"Machine learning is an increasingly used computational tool within human-computer interaction research. While most researchers currently utilize an iterative approach to refining classifier models and performance, we propose that ensemble classification techniques may be a viable and even preferable alternative. In ensemble learning, algorithms combine multiple classifiers to build one that is superior to its components. In this paper, we present EnsembleMatrix, an interactive visualization system that presents a graphical view of confusion matrices to help users understand relative merits of various classifiers. EnsembleMatrix allows users to directly interact with the visualizations in order to explore and build combination models. We evaluate the efficacy of the system and the approach in a user study. Results show that users are able to quickly combine multiple classifiers operating on multiple feature sets to produce an ensemble classifier with accuracy that approaches best-reported performance classifying images in the CalTech-101 dataset.","Pourang Irani,Justin Talbot,Bongshin Lee,Ashish Kapoor,Desney S. Tan",https://doi.org/10.1145/1518701.1518895
2009,Visualization 2,FacetLens: exposing trends and relationships to support sensemaking within faceted datasets,"Previous research has shown that faceted browsing is effective and enjoyable in searching and browsing large collections of data. In this work, we explore the efficacy of interactive visualization systems in supporting exploration and sensemaking within faceted datasets. To do this, we developed an interactive visualization system called FacetLens, which exposes trends and relationships within faceted datasets. FacetLens implements linear facets to enable users not only to identify trends but also to easily compare several trends simultaneously. Furthermore, it offers pivot operations to allow users to navigate the faceted dataset using relationships between items. We evaluate the utility of the system through a description of insights gained while experts used the system to explore the CHI publication repository as well as a database of funding grant data, and report a formative user study that identified usability issues.","Bongshin Lee,Greg Smith,George G. Robertson,Mary Czerwinski,Desney S. Tan",https://doi.org/10.1145/1518701.1518896
2009,Visualization 2,Sizing the horizon: the effects of chart size and layering on the graphical perception of time series visualizations,"We investigate techniques for visualizing time series data and evaluate their effect in value comparison tasks. We compare line charts with horizon graphs - a space-efficient time series visualization technique - across a range of chart sizes, measuring the speed and accuracy of subjects' estimates of value differences between charts. We identify transition points at which reducing the chart height results in significantly differing drops in estimation accuracy across the compared chart types, and we find optimal positions in the speed-accuracy tradeoff curve at which viewers performed quickly without attendant drops in accuracy. Based on these results, we propose approaches for increasing data density that optimize graphical perception.","Jeffrey Heer,Nicholas Kong,Maneesh Agrawala",https://doi.org/10.1145/1518701.1518897
2009,Cognitive modeling and assessment,Session details: Cognitive modeling and assessment,"Understanding and exploiting the abilities of the human visual system is an important part of the design of usable user interfaces and information visualizations. Good design enables quick, easy and veridical perception of key components of that design. An important facet of human vision is its ability to seemingly effortlessly perform ""perceptual organization; it transforms individual feature estimates into perception of coherent regions, structures, and objects. We perceive regions grouped by proximity and feature similarity, grouping of curves by good continuation, and grouping of regions of coherent texture. In this paper, we discuss a simple model for a broad range of perceptual grouping phenomena. It takes as input an arbitrary image, and returns a structure describing the predicted visual organization of the image. We demonstrate that this model can capture aspects of traditional design rules, and predicts visual percepts in classic perceptual grouping displays.","Duncan Brumby,Ruth Rosenholtz,Nathaniel R. Twarog,Nadja Schinkel-Bielefeld,Martin Wattenberg",https://doi.org/10.1145/1518701.1518903
2009,Studying Wikipedia,So you know you're getting the best possible information: a tool that increases Wikipedia credibility,"An experiment was conducted to study how credibility judgments about Wikipedia are affected by providing users with an interactive visualization (WikiDashboard) of article and author editing history. Overall, users who self-reported higher use of Internet information and higher rates of Wikipedia usage tended to produce lower credibility judgments about Wikipedia articles and authors. However, use of WikiDashboard significantly increased article and author credibility judgments, with effect sizes larger than any other measured effects of background media usage and attitudes on Wikiepedia credibility. The results suggest that increased exposure to the editing/authoring histories of Wikipedia increases credibility judgments.","Peter Pirolli,Evelin Wollny,Bongwon Suh",https://doi.org/10.1145/1518701.1518929
2009,Software development,Fisheyes in the field: using method triangulation to study the adoption and use of a source code visualization,"Information visualizations have been shown useful in numerous laboratory studies, but their adoption and use in real-life tasks are curiously under-researched. We present a field study of ten programmers who work with an editor extended with a fisheye view of source code. The study triangulates multiple methods (experience sampling, logging, thinking aloud, and interviews) to describe how the visualization is adopted and used. At the concrete level, our results suggest that the visualization was used as frequently as other tools in the programming environment. We also propose extensions to the interface and discuss features that were not used in practice. At the methodological level, the study identifies contributions distinct to individual methods and to their combination, and discusses the relative benefits of laboratory studies and field studies for the evaluation of information visualizations.","Mikkel Rønne Jakobsen,Kasper Hornbæk",https://doi.org/10.1145/1518701.1518943
2009,Designing for senior citizens,Desiring to be in touch in a changing communications landscape: attitudes of older adults,"This paper offers an exploration of the attitudes of older adults to keeping in touch with people who are important to them. We present findings from three focus groups with people from 55 to 81 years of age. Themes emerging from the findings suggest that older adults view the act of keeping in touch as being worthy of time and dedication, but also as being something that needs to be carefully managed within the context of daily life. Communication is seen as a means through which skill should be demonstrated and personality expressed, and is understood in a very different context to the lightweight interaction that is increasingly afforded by new technologies. The themes that emerged are used to elicit a number of design implications and to promote some illustrative design concepts for new communication devices.","Siân E. Lindley,Richard Harper,Abigail Sellen",https://doi.org/10.1145/1518701.1518962
2009,Understanding graphs,Session details: Understanding graphs,"Graphs are often visualized using node-link representations: vertices are depicted as dots, edges are depicted as (poly)lines connecting two vertices. A directed edge running from vertex A to B is generally visualized using an arrow representation: a (poly)line with a triangular arrowhead at vertex B. Although this representation is intuitive, it is not guaranteed that a user is able to determine edge direction as quickly and unambiguously as possible; alternative representations that exhibit less occlusion and visual clutter might be better suited. To investigate this, we developed five additional directed-edge representations using combinations of shape and color. We performed a user study in which subjects performed different tasks on a collection of graphs using these representations and combinations thereof to investigate which representation is best in terms of speed and accuracy. We present our initial hypotheses, the outcome of the user studies, and recommendations regarding directed-edge visualization.","Martin Wattenberg,Danny Holten,Jarke J. van Wijk",https://doi.org/10.1145/1518701.1519054
2009,Understanding graphs,Topology-aware navigation in large networks,"Applications supporting navigation in large networks are used every days by millions of people. They include road map navigators, flight route visualization systems, and network visualization systems using node-link diagrams. These applications currently provide generic interaction methods for navigation: pan-and-zoom and sometimes bird's eye views. This article explores the idea of exploiting the connection information provided by the network to help navigate these large spaces. We visually augment two traditional navigation methods, and develop two special-purpose techniques. The first new technique, called ""Link Sliding"", provides guided panning when continuously dragging along a visible link. The second technique, called ""Bring & Go"", brings adjacent nodes nearby when pointing to a node. We compare the performance of these techniques in both an adjacency exploration task and a node revisiting task. This comparison illustrates the various advantages of content-aware network navigation techniques. A significant speed advantage is found for the Bring & Go technique over other methods.","Tomer Moscovich,Fanny Chevalier,Nathalie Henry,Emmanuel Pietriga,Jean-Daniel Fekete",https://doi.org/10.1145/1518701.1519056
2009,Computer mediated communication 2,Conversation clusters: grouping conversation topics through human-computer dialog,"Conversation Clusters explores the use of visualization to highlight salient moments of live conversation while archiving a meeting. Cheaper storage and easy access to recording devices allows extensive archival. However, as the size of the archive grows, retrieving the desired moments becomes increasingly difficult. We approach this problem from a socio-technical perspective and utilize human intuition aided by computer memory. We present computationally detected topics of conversation as visual summaries of discussion and as reference points into the archive. To further bootstrap the system, humans can participate in a dialog with the visualization of the clustering process and shape the development of clustering models.","Tony Bergstrom,Karrie Karahalios",https://doi.org/10.1145/1518701.1519060
2010,Visualization,Session details: Visualization,"Understanding perception is critical to effective visualization design. With its low cost and scalability, crowdsourcing presents an attractive option for evaluating the large design space of visualizations; however, it first requires validation. In this paper, we assess the viability of Amazon's Mechanical Turk as a platform for graphical perception experiments. We replicate previous studies of spatial encoding and luminance contrast and compare our results. We also conduct new experiments on rectangular area perception (as in treemaps or cartograms) and on chart size and gridline spacing. Our results demonstrate that crowdsourced perception experiments are viable and contribute new insights for visualization design. Lastly, we report cost and performance data from our experiments and distill recommendations for the design of crowdsourced studies.","Polle Zellweger,Jeffrey Heer,Michael Bostock",https://doi.org/10.1145/1753326.1753357
2010,Visualization,ManyNets: an interface for multiple network analysis and visualization,"Traditional network analysis tools support analysts in studying a single network. ManyNets offers these analysts a powerful new approach that enables them to work on multiple networks simultaneously. Several thousand networks can be presented as rows in a tabular visualization, and then inspected, sorted and filtered according to their attributes. The networks to be displayed can be obtained by subdivision of larger networks. Examples of meaningful subdivisions used by analysts include ego networks, community extraction, and time-based slices. Cell visualizations and interactive column overviews allow analysts to assess the distribution of attributes within particular sets of networks. Details, such as traditional node-link diagrams, are available on demand. We describe a case study analyzing a social network geared towards film recommendations by means of decomposition. A small usability study provides feedback on the use of the interface on a set of tasks issued from the case study.","Manuel Freire,Catherine Plaisant,Ben Shneiderman,Jen Golbeck",https://doi.org/10.1145/1753326.1753358
2010,Visualization,A comparative evaluation on tree visualization methods for hierarchical structures with large fan-outs,"Hierarchical structures with large fan-outs are hard to browse and understand. In the conventional node-link tree visualization, the screen quickly becomes overcrowded as users open nodes that have too many child nodes to fit in one screen. To address this problem, we propose two extensions to the conventional node-link tree visualization: a list view with a scrollbar and a multi-column interface. We compared them against the conventional tree visualization interface in a user study. Results show that users are able to browse and understand the tree structure faster with the multi-column interface than the other two interfaces. Overall, they also liked the multi-column better than others.","Hyunjoo Song,Bohyoung Kim,Bongshin Lee,Jinwook Seo",https://doi.org/10.1145/1753326.1753359
2010,Interfaces and visualization,Session details: Interfaces and visualization,"We define occlusion-aware interfaces as interaction techniques which know what area of the display is currently occluded, and use this knowledge to counteract potential problems and/or utilize the hidden area. As a case study, we describe the Occlusion-Aware Viewer, which identifies important regions hidden beneath the hand and displays them in a non-occluded area using a bubble-like callout. To determine what is important, we use an application agnostic image processing layer. For the occluded area, we use a user configurable, real-time version of Vogel et al.'s [21] geometric model. In an evaluation with a simultaneous monitoring task, we find the technique can successfully mitigate the effects of occlusion, although issues with ambiguity and stability suggest further refinements. Finally, we present designs for three other occlusion-aware techniques for pop-ups, dragging, and a hidden widget.","Patrick Baudisch,Daniel Vogel,Ravin Balakrishnan",https://doi.org/10.1145/1753326.1753365
2010,"Dance, dust, and drama: designing design",The Case of the Disappearing Ox: Seeing Through Digital Images to an Analysis of Ancient Texts,"There are numerous settings where people examine, scrutinize and discuss the details of images in the course of their work. In most medical domains, scans and x-rays are used in the diagnosis of cases; in most areas of science, methods of visualization have been adopted to assist in the analysis of data; and images of different kinds are critical for many research fields in the social sciences and humanities. It is not surprising that recently technologies have been proposed to assist with the analysis and examination of images. In this paper, we consider requirements for technologies in a rather distinctive domain of research, the classics. Drawing upon an analysis of the detailed ways in which classicists work with digital images, we discuss the requirements for systems to support researchers in this domain, and also provide further considerations on the general development of image processing technologies and visualization techniques.","Grace de la Flor,Paul Luff,Marina Jirotka,John Pybus,Ruth Kirkham,Annamaria Carusi",https://doi.org/10.1145/1753326.1753397
2010,Organizing and organizations,Session details: Organizing and organizations,"This paper explores timelines as a web-based tool for collaboration between citizens and municipal caseworkers. The paper takes its outset in a case study of planning and control of parental leave; a process that may involve surprisingly many actors. As part of the case study, a web-based timeline, CaseLine, was designed. This design crosses the boundaries between leisure and work, in ways that are different from what is often seen in current HCI. The timeline has several roles on these boundaries: It is a shared planning and visualization tool that may be used by parents and caseworkers alone or together, it serves as a contract and a sandbox, as a record and a plan, as inspiration for planning and an authoritative road, as a common information space and a fragmented exchange. Serving all these roles does not happen smoothly, and the paper discusses the challenges of such timeline interaction in, and beyond this case.","Arnie Lund,Morten Bohøj,Nikolaj Gandrup Borchorst,Niels Olof Bouvin,Susanne Bødker,Pär-Ola Zander",https://doi.org/10.1145/1753326.1753404
2010,Browsing,Using text animated transitions to support navigation in document histories,"This article examines the benefits of using text animated transitions for navigating in the revision history of textual documents. We propose an animation technique for smoothly transitioning between different text revisions, then present the Diffamation system. Diffamation supports rapid exploration of revision histories by combining text animated transitions with simple navigation and visualization tools. We finally describe a user study showing that smooth text animation allows users to track changes in the evolution of textual documents more effectively than flipping pages.","Fanny Chevalier,Pierre Dragicevic,Anastasia Bezerianos,Jean-Daniel Fekete",https://doi.org/10.1145/1753326.1753427
