year,session,title,abstract,authors,doi
2013,Papers: text visualization,Session details: Papers: text visualization,"A valuable task in text visualization is to have viewers make judgments about text that has been annotated (either by hand or by some algorithm such as text clustering or entity extraction). In this work we look at the ability of viewers to make judgments about the relative quantities of tags in annotated text (specifically text tagged with one of a set of qualitatively distinct colors), and examine design choices that can improve performance at extracting statistical information from these texts. We find that viewers can efficiently and accurately estimate the proportions of tag levels over a range of situations; however accuracy can be improved through color choice and area adjustments.","m.c. schraefel,Michael A. Correll,Eric C. Alexander,Michael Gleicher",https://doi.org/10.1145/2470654.2481373
2013,Papers: text visualization,Contextifier: automatic generation of annotated stock visualizations,"Online news tools - for aggregation, summarization and automatic generation - are an area of fruitful development as reading news online becomes increasingly commonplace. While textual tools have dominated these developments, annotated information visualizations are a promising way to complement articles based on their ability to add context. But the manual effort required for professional designers to create thoughtful annotations for contextualizing news visualizations is difficult to scale. We describe the design of Contextifier, a novel system that automatically produces custom, annotated visualizations of stock behavior given a news article about a company. Contextifier's algorithms for choosing annotations is informed by a study of professionally created visualizations and takes into account visual salience, contextual relevance, and a detection of key events in the company's history. In evaluating our system we find that Contextifier better balances graphical salience and relevance than the baseline.","Jessica Hullman,Nicholas Diakopoulos,Eytan Adar",https://doi.org/10.1145/2470654.2481374
2013,Papers: text visualization,Effects of visualization and note-taking on sensemaking and analysis,"Many sophisticated tools have been developed to help analysts detect patterns in large datasets, but the value of these tools' individual features is rarely tested. In an experiment in which participants played detectives solving homicides, we tested the utility of a visualization of data links and a notepad for collecting and organizing annotations. The visualization significantly improved participants' ability to solve the crime whereas the notepad did not. Having both features available provided no benefit over having just the visualization. The results raise questions about the potential constraints on the usefulness of intelligence analysis tools.","Nitesh Goyal,Gilly Leshed,Susan R. Fussell",https://doi.org/10.1145/2470654.2481376
2013,Papers: sustainability,inAir: a longitudinal study of indoor air quality measurements and visualizations,"Indoor air quality (IAQ) is important for health as people spend the majority of time indoors, and it is particularly interesting over outdoor air because it strongly ties to indoor activities. Some activities easily exacerbate IAQ, resulting in serious pollution. However, people may not notice such changes because many pollutants are colorless and odorless, while many activities are inconspicuous and routine. We implemented inAir, a system that measures and visualizes IAQ that households appropriate and integrate into everyday life. The research goals of this work include understanding the IAQ dynamics with respect to habitual behaviors and analyzing behavioral and quantitative changes towards improving IAQ by the use of inAir. From our longitudinal study for four months, we found that inAir successfully elicited the reflection upon, and the modification of habitual behaviors for healthy domestic environments, which resulted in the significant improvement of IAQ.","Sunyoung Kim,Eric Paulos,Jennifer Mankoff",https://doi.org/10.1145/2470654.2481380
2013,Papers: visual perception,Session details: Papers: visual perception,"Recent research suggests that individual personality differences can influence performance with visualizations. In addition to stable personality traits, research in psychology has found that temporary changes in affect (emotion) can also significantly impact performance during cognitive tasks. In this paper, we show that affective priming also influences user performance on visual judgment tasks through an experiment that combines affective priming with longstanding graphical perception experiments. Our results suggest that affective priming can influence accuracy in common graphical perception tasks. We discuss possible explanations for these findings, and describe how these findings can be applied to design visualizations that are less (or more) susceptible to error in common visualization contexts.","Paul Marshall,Lane Harrison,Drew Skau,Steven Franconeri,Aidong Lu,Remco Chang",https://doi.org/10.1145/2470654.2481410
2013,Papers: spatial interfaces,Canyon: providing location awareness of multiple moving objects in a detail view on large displays,"Overview+Detail interfaces can be used to examine the details of complex data while retaining the data's overall context. Dynamic data introduce challenges for these interfaces, however, as moving objects may exit the detail view, as well as a person's field of view if they are working at a large interactive surface. To address this ""off-view"" problem, we propose a new information visualization technique, called Canyon. This technique attaches a small view of an off-view object, including some surrounding context, to the external boundary of the detail view. The area between the detail view and the region containing the off-view object is virtually ""folded"" to conserve space. A comparison study was conducted contrasting the benefits and limitations of Canyon to an established technique, called Wedge. Canyon was more accurate across a number of tasks, especially more complex tasks, and was comparably efficient.","Alexandra Ion,Y.-L. Betty Chang,Michael Haller,Mark Hancock,Stacey D. Scott",https://doi.org/10.1145/2470654.2466431
2013,Papers: information visualization,Session details: Papers: information visualization,"Many approaches have been proposed for the visualization of multiple time series. Two prominent approaches are reduced line charts (RLC), which display small multiples for time series, and the more recent horizon graphs (HG). We propose to unify RLC and HG using a new technique - interactive horizon graphs (IHG) - which uses pan and zoom interaction to increase the number of time series that can be analysed in parallel. In a user study we compared RLC, HG, and IHG across several tasks and numbers of time series, focusing on datasets with both large scale and small scale variations. Our results show that IHG outperform the other two techniques in complex comparison and matching tasks where the number of charts is large. In the hardest task PHG have a significantly higher number of good answers (correctness) than HG (+14%) and RLC (+51%) and a lower error magnitude than HG (-64%) and RLC (-86%).","Pierre Dragicevic,Charles Perin,Frédéric Vernier,Jean-Daniel Fekete",https://doi.org/10.1145/2470654.2466441
2013,Papers: information visualization,Patina: dynamic heatmaps for visualizing application usage,"We present Patina, an application independent system for collecting and visualizing software application usage data. Patina requires no instrumentation of the target application, all data is collected through standard window metrics and accessibility APIs. The primary visualization is a dynamic heatmap overlay which adapts to match the content, location, and shape of the user interface controls visible in the active application. We discuss a set of design guidelines for the Patina system, describe our implementation of the system, and report on an initial evaluation based on a short-term deployment of the system.","Justin Matejka,Tovi Grossman,George Fitzmaurice",https://doi.org/10.1145/2470654.2466442
2013,Papers: information visualization,Evaluation of alternative glyph designs for time series data in a small multiple setting,"We present the results of a controlled experiment to investigate the performance of different temporal glyph designs in a small multiple setting. Analyzing many time series at once is a common yet difficult task in many domains, for example in network monitoring. Several visualization techniques have, thus, been proposed in the literature. Among these, iconic displays or glyphs are an appropriate choice because of their expressiveness and effective use of screen space. Through a controlled experiment, we compare the performance of four glyphs that use different combinations of visual variables to encode two properties of temporal data: a) the position of a data point in time and b) the quantitative value of this data point. Our results show that depending on tasks and data density, the chosen glyphs performed differently. Line Glyphs are generally a good choice for peak and trend detection tasks but radial encodings are more effective for reading values at specific temporal locations. From our qualitative analysis we also contribute implications for designing temporal glyphs for small multiple settings.","Johannes Fuchs,Fabian Fischer,Florian Mansmann,Enrico Bertini,Petra Isenberg",https://doi.org/10.1145/2470654.2466443
2013,Papers: information visualization,"Motif simplification: improving network visualization readability with fan, connector, and clique glyphs","Analyzing networks involves understanding the complex relationships between entities, as well as any attributes they may have. The widely used node-link diagrams excel at this task, but many are difficult to extract meaning from because of the inherent complexity of the relationships and limited screen space. To help address this problem we introduce a technique called motif simplification, in which common patterns of nodes and links are replaced with compact and meaningful glyphs. Well-designed glyphs have several benefits: they (1) require less screen space and layout effort, (2) are easier to understand in the context of the network, (3) can reveal otherwise hidden relationships, and (4) preserve as much underlying information as possible. We tackle three frequently occurring and high-payoff motifs: fans of nodes with a single neighbor, connectors that link a set of anchor nodes, and cliques of completely connected nodes. We contribute design guidelines for motif glyphs; example glyphs for the fan, connector, and clique motifs; algorithms for detecting these motifs; a free and open source reference implementation; and results from a controlled study of 36 participants that demonstrates the effectiveness of motif simplification.","Cody Dunne,Ben Shneiderman",https://doi.org/10.1145/2470654.2466444
2013,Papers: tensions in social media,Session details: Papers: tensions in social media,"Public displays and projections are becoming increasingly available in various informal urban settings. However, their potential impact on informing and engaging citizens on relevant issues has still been largely unexplored. In this paper, we show that visualizations displayed in public settings are able to increase social awareness and discourse by exposing underlying patterns in data that is submitted by citizens. We thus introduce the design and evaluation of Reveal-it!, a public, interactive projection that facilitates the comparison of the energy consumptions of individuals and communities. Our in-the-wild deployment in three distinct physical locations provided insights into: 1) how people responded to this form of display in different contexts; 2) how it influenced people's perception and discussion of individual and communal data; and 3) the implications for a public visualization as a tool for increasing awareness and discourse. We conclude by discussing emerging participant behaviors, as well as some challenges involved in facilitating a socially motivated crowd-sourced visualization in the public context.","Valentina Nisi,Nina Valkanova,Sergi Jorda,Martin Tomitsch,Andrew Vande Moere",https://doi.org/10.1145/2470654.2466476
2014,Visualization and aesthetics,Session details: Visualization and aesthetics,"Through our art project, Metaphone, we explored a particular form of aesthetics referred to in the arts tradition as machine aesthetics. The Metaphone machine collects the participant's bio-data, Galvanic Skin Response (GSR) and Heart Rate (HR), creating a process of movement, painting and sound. The machine behaves in machine-like, aesthetically evocative ways: a shaft on two large wheels rotates on the floor, carrying paint that is dripped onto a large sheet of aquarelle paper on the floor according to bio-sensor data. A soundscape rhythmically follows the bio-sensor data, but also has its own machine-like sounds. Six commentators were invited to interact with the machine. They reported a strangely relaxing atmosphere induced by the machine. Based on these experiences we discuss how different art styles can help to describe aesthetics in interaction design generally, and how machine aesthetics in particular can be used to create interesting, sustained, stylistically coherent interactions.","Antonella De Angeli,Vygandas Šimbelis,Anders Lundström,Kristina Höök,Jordi Solsona,Vincent Lewandowski",https://doi.org/10.1145/2556288.2557152
2014,Audio interaction,ISSE: an interactive source separation editor,"Traditional audio editing tools do not facilitate the task of separating a single mixture recording (e.g. pop song) into its respective sources (e.g. drums, vocal, etc.). Such ability, however, would be very useful for a wide variety of audio applications such as music remixing, audio denoising, and audio-based forensics. To address this issue, we present ISSE - an interactive source separation editor. ISSE is a new open-source, freely available, and cross-platform audio editing tool that enables a user to perform source separation by painting on time-frequency visualizations of sound, resulting in an interactive machine learning system. The system brings to life our previously proposed interaction paradigm and separation algorithm that learns from user-feedback to perform separation. For evaluation, we conducted user studies and compared results between inexperienced and expert users. For a variety of real-world tasks, we found that inexperienced users can achieve good separation quality with minimal instruction and expert users can achieve state-of-the-art separation quality.","Nicholas J. Bryan,Gautham J. Mysore,Ge Wang",https://doi.org/10.1145/2556288.2557253
2014,Studying and designing gameplay,Session details: Studying and designing gameplay,"With the rising interest in multiplayer gaming, gameplay statistics have become an increasingly important aspect of the overall game experience for many players. As a part of this trend, visualizations have gained great popularity among players, in particular heatmaps since they allow them to reenact the course of a game and to develop new strategies. In this paper we report results of a user study conducted with 29 players (i) to investigate how players use heatmaps and two further graphical representations that use clustering algorithms to interpret gameplay and (ii) to assess the three representations in regard to time efficiency, correctness, suitability, and player preference. Our results show that heatmaps were mainly used to detect hot spots while the cluster representations proved useful to compare variables, allowing the players to uncover relationships between them and in turn allowing a deeper insight into the gameplay data.","Carl Gutwin,Simone Kriglstein,Günter Wallner,Margit Pohl",https://doi.org/10.1145/2556288.2557317
2014,Designing and understanding visualizations,Session details: Designing and understanding visualizations,"Authors use icon encodings to indicate the semantics of categorical information in visualizations. The default icon libraries found in visualization tools often do not match the semantics of the data. Users often manually search for or create icons that are more semantically meaningful. This process can hinder the flow of visual analysis, especially when the amount of data is large, leading to a suboptimal user experience. We propose a technique for automatically generating semantically relevant icon encodings for categorical dimensions of data points. The algorithm employs natural language processing in order to find relevant imagery from the Internet. We evaluate our approach on Mechanical Turk by generating large libraries of icons using Tableau Public workbooks that represent real analytical effort by people out in the world. Our results show that the automatic algorithm does nearly as well as the manually created icons, and particularly has higher user satisfaction for larger cardinalities of data.","Petra Isenberg,Vidya Setlur,Jock D. Mackinlay",https://doi.org/10.1145/2556288.2557408
2014,Designing and understanding visualizations,Task-driven evaluation of aggregation in time series visualization,"Many visualization tasks require the viewer to make judgments about aggregate properties of data. Recent work has shown that viewers can perform such tasks effectively, for example to efficiently compare the maximums or means over ranges of data. However, this work also shows that such effectiveness depends on the designs of the displays. In this paper, we explore this relationship between aggregation task and visualization design to provide guidance on matching tasks with designs. We combine prior results from perceptual science and graphical perception to suggest a set of design variables that influence performance on various aggregate comparison tasks. We describe how choices in these variables can lead to designs that are matched to particular tasks. We use these variables to assess a set of eight different designs, predicting how they will support a set of six aggregate time series comparison tasks. A crowd-sourced evaluation confirms these predictions. These results not only provide evidence for how the specific visualizations support various tasks, but also suggest using the identified design variables as a tool for designing visualizations well suited for various types of tasks.","Danielle Albers,Michael Correll,Michael Gleicher",https://doi.org/10.1145/2556288.2557200
2014,Designing and understanding visualizations,Dive in!: enabling progressive loading for real-time navigation of data visualizations,"We introduce Splash, a framework reducing development overhead for both data curators and visualization developers of client-server visualization systems. Splash streamlines the process of creating a multiple level-of-detail version of the data and facilitates progressive data download, thereby enabling real-time, on-demand navigation with existing visualization toolkits. As a result, system responsiveness is increased and the user experience is improved. We demonstrate the benefit of progressive loading for user interaction on slower networks. Additionally, case study evaluations of Splash with real-world data curators suggest that Splash supports iterative refinement of visualizations and promotes the use of exploratory data analysis.","Michael Glueck,Azam Khan,Daniel J. Wigdor",https://doi.org/10.1145/2556288.2557195
2014,Designing and understanding visualizations,"Sample-oriented task-driven visualizations: allowing users to make better, more confident decisions","We often use datasets that reflect samples, but many visualization tools treat data as full populations. Uncertain visualizations are good at representing data distributions emerging from samples, but are more limited in allowing users to carry out decision tasks. This is because tasks that are simple on a traditional chart (e.g. ""compare two bars"") become a complex probabilistic task on a chart with uncertainty. We present guidelines for creating visual annotations for solving tasks with uncertainty, and an implementation that addresses five core tasks on a bar chart. A preliminary user study shows promising results: that users have a justified confidence in their answers with our system.","Nivan Ferreira,Danyel Fisher,Arnd Christian Konig",https://doi.org/10.1145/2556288.2557131
2014,Always connected: email and social media,Session details: Always connected: email and social media,"Constant connectivity and total availability to clients is the rule rather than the exception in many contemporary workplaces. Enabled by developments in information and communication technologies (ICTs), total availability of employees is possible and presumed. Scholars have explored how new technological affordances, cultural shifts, individual personality traits, and/or the development of social expectations that reinforce norms of constant connectivity have led to this state of affairs. We argue that a key factor has been overlooked in current scholarship about stress, intensive work, and constant connectivity. That is, current economic conditions are creating a marketplace in which firms increasing sell the availability of their employees as part of the services offered by the firm. In this paper we use qualitative data to illustrate how total availability is an integral aspect of the 'product' offered by professional service firms and is becoming increasingly prevalent in other service industries. We conclude with a discussion of how the HCI community might address this situation as a design challenge. Drawing on the work of Goffman and Perlow, we suggest that designers attend to the ways in which organizations might maintain front stage impressions of total availability while collectively managing individual time to restrict total availability behind the scenes.","Svetlana Yarosh,Melissa Mazmanian,Ingrid Erickson",https://doi.org/10.1145/2556288.2557381
2014,Interactive visualization and visual elements,Session details: Interactive visualization and visual elements,"Designing visualizations of dynamic networks is challenging, both because the data sets tend to be complex and because the tasks associated with them are often cognitively demand- ing. We introduce the Matrix Cube, a novel visual representation and navigation model for dynamic networks, inspired by the way people comprehend and manipulate physical cubes. Users can change their perspective on the data by rotating or decomposing the 3D cube. These manipulations can produce a range of different 2D visualizations that emphasize specific aspects of the dynamic network suited to particular analysis tasks. We describe Matrix Cubes and the interactions that can be performed on them in the Cubix system. We then show how two domain experts, an astronomer and a neurologist, used Cubix to explore and report on their own network data.","Eytan Adar,Benjamin Bach,Emmanuel Pietriga,Jean-Daniel Fekete",https://doi.org/10.1145/2556288.2557010
2014,Interactive visualization and visual elements,Kinetica: naturalistic multi-touch data visualization,"Over the last several years there has been an explosion of powerful, affordable, multi-touch devices. This provides an outstanding opportunity for novel data visualization techniques that leverage new interaction methods and minimize their barriers to entry. In this paper we describe an approach for multivariate data visualization that uses physics-based affordances that are easy to intuit, constraints that are easy to apply and visualize, and a consistent view as data is manipulated in order to promote data exploration and interrogation. We provide a framework for exploring this problem space, and an example proof of concept system called Kinetica. We describe the results of a user study that suggest users of Kinetica were able to explore multiple dimensions of data at once, identify outliers, and discover trends with minimal training.","Jeffrey M. Rzeszotarski,Aniket Kittur",https://doi.org/10.1145/2556288.2557231
2014,Interactive visualization and visual elements,Traffigram: distortion for clarification via isochronal cartography,"Most geographic maps visually represent physical distance; however, travel time can in some cases be more important than distance because it directly indicates availability. The technique of creating maps from temporal data is known as isochronal cartography, and is a form of distortion for clarification. In an isochronal map, congestion s areas, while ideal travel conditions make the map shrink in comparison to the actual distance scale of a traditional map. Although there have been many applications of this technique, detailed user studies of its efficacy remain scarce, and there are conflicting views on its practical value. To attempt to settle this issue, we utilized a user-centered design process to determine which features of isochronal cartography might be most usable in practice. We developed an interactive cartographic visualization system, Traffigram, that features a novel combination of efficient isochronal map algorithms and an interface designed to give map users a quick and seamless experience while preserving geospatial integrity and aesthetics. We validated our design choices with multiple usability studies. We present our results and discuss implications for design.","Sungsoo (Ray) Hong,Yea-Seul Kim,Jong-Chul Yoon,Cecilia R. Aragon",https://doi.org/10.1145/2556288.2557224
