year,session,title,abstract,author,doi
2014,No Sessions,The Perception of Visual UncertaintyRepresentation by Non-Experts,"We tested how non-experts judge point probability for seven different visual representations of uncertainty, using a case from an unfamiliar domain. Participants (n = 140) rated the probability that the boundary between two earth layers passed through a given point, for seven different visualizations of the positional uncertainty of the boundary. For all types of visualizations, most observers app...","Susanne Tak,Alexander Toet,Jan van Erp,",https://ieeexplore.ieee.org/document/6654171/
2014,No Sessions,Toward Evaluating the Usefulness of GlobalIllumination for Novices in Lighting Design Tasks,"Thanks to its ability to improve the realism of computer-generated imagery, the use of global illumination has recently become widespread among digital lighting artists. It remains unclear, though, what impact it has on the lighting design workflows, especially for novice users. In this paper we present a user study which investigates the use of global illumination, large area lights, and non-phys...","Ondr̆ej Karlík,Martin Ru̇z̆ic̆ka,Václav Gassenbauer,Fabio Pellacini,Jaroslav Kr̆ivánek,",https://ieeexplore.ieee.org/document/6654124/
2014,No Sessions,Editor's Note,No Abstract,"Ming C. Lin,",https://ieeexplore.ieee.org/document/6776318/
2014,No Sessions,Assessing the Ability of a VR-Based Assembly Task Simulation to Evaluate PhysicalRisk Factors,Nowadays the process of workstation design tends to include assessment steps in a virtual environment (VE) to evaluate the ergonomic features. These approaches are cost-effective and convenient since working directly on the digital mock-up in a VE is preferable to constructing a real physical mock-up in a real environment (RE). This study aimed at understanding the ability of a VR-based assembly t...,"Charles Pontonnier,Afshin Samani,Marwan Badawi,Pascal Madeleine,Georges Dumont,",https://ieeexplore.ieee.org/document/6654129/
2014,No Sessions,Bas-Relief Modeling from Normal Images with Intuitive Styles,"Traditional 3D model-based bas-relief modeling methods are often limited to model-dependent and monotonic relief styles. This paper presents a novel method for digital bas-relief modeling with intuitive style control. Given a composite normal image, the problem discussed in this paper involves generating a discontinuity-free depth field with high compression of depth data while preserving or even ...","Zhongping Ji,Weiyin Ma,Xianfang Sun,",https://ieeexplore.ieee.org/document/6684153/
2014,No Sessions,Blood Flow Clustering and Applications inVirtual Stenting of Intracranial Aneurysms,"Understanding the hemodynamics of blood flow in vascular pathologies such as intracranial aneurysms is essential for both their diagnosis and treatment. Computational fluid dynamics (CFD) simulations of blood flow based on patient-individual data are performed to better understand aneurysm initiation and progression and more recently, for predicting treatment success. In virtual stenting, a flow-d...","Steffen Oeltze,Dirk J. Lehmann,Alexander Kuhn,Gábor Janiga,Holger Theisel,Bernhard Preim,",https://ieeexplore.ieee.org/document/6702500/
2014,No Sessions,Chess Evolution Visualization,"We present a chess visualization to convey the changes in a game over successive generations. It contains a score chart, an evolution graph and a chess board, such that users can understand a game from global to local viewpoints. Unlike current graphical chess tools, which focus only on highlighting pieces that are under attack and require sequential investigation, our visualization shows potentia...","Wei-Li Lu,Yu-Shuen Wang,Wen-Chieh Lin,",https://ieeexplore.ieee.org/document/6710145/
2014,No Sessions,Exact and Adaptive Signed Distance FieldsComputation for Rigid and DeformableModels on GPUs,"Most techniques for real-time construction of a signed distance field, whether on a CPU or GPU, involve approximate distances. We use a GPU to build an exact adaptive distance field, constructed from an octree by using the Morton code. We use rectangle-swept spheres to construct a bounding volume hierarchy (BVH) around a triangulated model. To speed up BVH construction, we can use a multi-BVH stru...","Fuchang Liu,Young J. Kim,",https://ieeexplore.ieee.org/document/6684160/
2014,No Sessions,GazeVis: Interactive 3D Gaze Visualization for Contiguous Cross-Sectional Medical Images,"Gaze visualization has been used to understand the results from gaze tracking studies in a wide range of fields. In the medical field, diagnoses of medical images have been studied with gaze tracking technology to understand how radiologists read medical images. While prior work were mainly based on diagnosis with a single image, recent work focused on diagnosis with consecutive cross-sectional me...","Hyunjoo Song,Jihye Yun,Bohyoung Kim,Jinwook Seo,",https://ieeexplore.ieee.org/document/6687159/
2014,No Sessions,GraphDiaries: Animated Transitions andTemporal Navigation for Dynamic Networks,"Identifying, tracking and understanding changes in dynamic networks are complex and cognitively demanding tasks. We present GraphDiaries, a visual interface designed to improve support for these tasks in any node-link based graph visualization system. GraphDiaries relies on animated transitions that highlight changes in the network between time steps, thus helping users identify and understand tho...","Benjamin Bach,Emmanuel Pietriga,Jean-Daniel Fekete,",https://ieeexplore.ieee.org/document/6658746/
2014,No Sessions,Hierarchical and Controlled Advancement for Continuous Collision Detectionof Rigid and Articulated Models,"We present fast CCD algorithm for general rigid and articulated models based on conservative advancement. We have implemented the CCD algorithm with two different acceleration techniques which can handle rigid models, and have extended one of them to articulated models. The resulting algorithms take a few milliseconds for rigid models with tens of thousands of triangles, and a few milliseconds for...","Min Tang,Dinesh Manocha,Young J. Kim,",https://ieeexplore.ieee.org/document/6684141/
2014,No Sessions,Hybrid Rendering with Scheduling under Uncertainty,"As scientific data of increasing size is generated by today's simulations and measurements, utilizing dedicated server resources to process the visualization pipeline becomes necessary. In a purely server-based approach, requirements on the client-side are minimal as the client only displays results received from the server. However, the client may have a considerable amount of hardware available,...","Georg Tamm,Jens Krüger,",https://ieeexplore.ieee.org/document/6727579/
2014,No Sessions,Importance-Driven Accessory Lights Designfor Enhancing Local Shapes,"We introduce a semi-automatic lighting design method that deploys per-voxel accessory lights (fill and detail lights) to enhance local shapes, as well as to increase the perceptibility and visual saliency of an object. Our approach allows the user to manually design arbitrary lights in a scene for creating the desired feeling of emotion. The user designed lights are used as key lights and our appr...","Lei Wang,Arie E. Kaufman,",https://ieeexplore.ieee.org/document/6671604/
2014,No Sessions,Improving the Efficiency of Viewpoint Composition,"In this paper, we concentrate on the problem of finding the viewpoint that best satisfies a set of visual composition properties, often referred to as Virtual Camera or Viewpoint Composition. Previous approaches in the literature, which are based on general optimization solvers, are limited in their practical applicability because of unsuitable computation times and limited experimental analysis. ...","Roberto Ranon,Tommaso Urli,",https://ieeexplore.ieee.org/document/6702501/
2014,No Sessions,Stroscope: Multi-Scale Visualization of Irregularly Measured Time-Series Data,"For irregularly measured time-series data, the measurement frequency or interval is as crucial information as measurements are. A well-known time-series visualization such as the line graph is good at showing an overall temporal pattern of change; however, it is not so effective in revealing the measurement frequency/interval while likely giving illusory confidence in values between measurements. ...","Myoungsu Cho,Bohyoung Kim,Hee-Joon Bae,Jinwook Seo,",https://ieeexplore.ieee.org/document/6702502/
2014,No Sessions,IEEE Transactions on Visualization and Computer Graphics - 2014 IEEE Virtual Reality Conference [title page],No Abstract,,https://ieeexplore.ieee.orgNo doi
2014,No Sessions,Table of contents,No Abstract,,https://ieeexplore.ieee.orgNo doi
2014,No Sessions,Message from the Editor-in Chief,No Abstract,"Ming C. Lin,",https://ieeexplore.ieee.org/document/6777467/
2014,No Sessions,Message from the Paper Chairs and Guest Editors,No Abstract,"Sabine Coquillart,Kiyoshi Kiyokawa,J. Edward Swan,Doug Bowman,",https://ieeexplore.ieee.org/document/6777455/
2014,No Sessions,Message from the General Chairs,No Abstract,"Victoria Interrante,Daniel F. Keefe,Benjamin Lok,Greg Welch,",https://ieeexplore.ieee.org/document/6777450/
2014,No Sessions,IEEE Visualization and Graphics Technical Committee,No Abstract,,https://ieeexplore.ieee.org/document/6777459/
2014,No Sessions,VR Conference Committee,No Abstract,,https://ieeexplore.ieee.org/document/6777451/
2014,No Sessions,International Program Committee,No Abstract,,https://ieeexplore.ieee.org/document/6777447/
2014,No Sessions,The 2014 Virtual Reality Career Award: Steve Feiner,No Abstract,,https://ieeexplore.ieee.orgNo doi
2014,No Sessions,The 2014 Virtual Reality Technical Achievement Award: Doug A. Bowman,No Abstract,,https://ieeexplore.ieee.orgNo doi
2014,No Sessions,Source and Listener Directivity for Interactive Wave-Based Sound Propagation,"We present an approach to model dynamic, data-driven source and listener directivity for interactive wave-based sound propagation in virtual environments and computer games. Our directional source representation is expressed as a linear combination of elementary spherical harmonic (SH) sources. In the preprocessing stage, we precompute and encode the propagated sound fields due to each SH source. ...","Ravish Mehra,Lakulish Antani,Sujeong Kim,Dinesh Manocha,",https://ieeexplore.ieee.org/document/6777442/
2014,No Sessions,Effects of VR System Fidelity on Analyzing Isosurface Visualization of Volume Datasets,"Volume visualization is an important technique for analyzing datasets from a variety of different scientific domains. Volume data analysis is inherently difficult because volumes are three-dimensional, dense, and unfamiliar, requiring scientists to precisely control the viewpoint and to make precise spatial judgments. Researchers have proposed that more immersive (higher fidelity) VR systems might...","Bireswar Laha,Doug A. Bowman,John J. Socha,",https://ieeexplore.ieee.org/document/6777465/
2014,No Sessions,Mixed Reality Virtual Pets to Reduce Childhood Obesity,"Novel approaches are needed to reduce the high rates of childhood obesity in the developed world. While multifactorial in cause, a major factor is an increasingly sedentary lifestyle of children. Our research shows that a mixed reality system that is of interest to children can be a powerful motivator of healthy activity. We designed and constructed a mixed reality system that allowed children to ...","Kyle Johnsen,Sun Joo Ahn,James Moore,Scott Brown,Thomas P. Robertson,Amanda Marable,Aryabrata Basu,",https://ieeexplore.ieee.org/document/6777460/
2014,No Sessions,Global Localization from Monocular SLAM on a Mobile Phone,"We propose the combination of a keyframe-based monocular SLAM system and a global localization method. The SLAM system runs locally on a camera-equipped mobile client and provides continuous, relative 6DoF pose estimation as well as keyframe images with computed camera locations. As the local map expands, a server process localizes the keyframes with a pre-made, globally-registered map and returns...","Jonathan Ventura,Clemens Arth,Gerhard Reitmayr,Dieter Schmalstieg,",https://ieeexplore.ieee.org/document/6777443/
2014,No Sessions,Geometrically-Correct Projection-Based Texture Mapping onto a Deformable Object,"Projection-based Augmented Reality commonly employs a rigid substrate as the projection surface and does not support scenarios where the substrate can be reshaped. This investigation presents a projection-based AR system that supports deformable substrates that can be bent, twisted or folded. We demonstrate a new invisible marker embedded into a deformable substrate and an algorithm that identifie...","Yuichiro Fujimoto,Ross T. Smith,Takafumi Taketomi,Goshiro Yamamoto,Jun Miyazaki,Hirokazu Kato,Bruce H. Thomas,",https://ieeexplore.ieee.org/document/6777427/
2014,No Sessions,FlyAR: Augmented Reality Supported Micro Aerial Vehicle Navigation,"Micro aerial vehicles equipped with high-resolution cameras can be used to create aerial reconstructions of an area of interest. In that context automatic flight path planning and autonomous flying is often applied but so far cannot fully replace the human in the loop, supervising the flight on-site to assure that there are no collisions with obstacles. Unfortunately, this workflow yields several ...","Stefanie Zollmann,Christof Hoppe,Tobias Langlotz,Gerhard Reitmayr,",https://ieeexplore.ieee.org/document/6777462/
2014,No Sessions,Establishing the Range of Perceptually Natural Visual Walking Speeds for Virtual Walking-In-Place Locomotion,"Walking-In-Place (WIP) techniques make it possible to facilitate relatively natural locomotion within immersive virtual environments that are larger than the physical interaction space. However, in order to facilitate natural walking experiences one needs to know how to map steps in place to virtual motion. This paper describes two within-subjects studies performed with the intention of establishi...","Niels Christian Nilsson,Stefania Serafin,Rolf Nordahl,",https://ieeexplore.ieee.org/document/6777444/
2014,No Sessions,Performance of Redirected Walking Algorithms in a Constrained Virtual World,"Redirected walking algorithms imperceptibly rotate a virtual scene about users of immersive virtual environment systems in order to guide them away from tracking area boundaries. Ideally, these distortions permit users to explore large unbounded virtual worlds while walking naturally within a physically limited space. Many potential virtual worlds are composed of corridors, passageways, or aisles....","Eric Hodgson,Eric Bachmann,Tyler Thrash,",https://ieeexplore.ieee.org/document/6777456/
2014,No Sessions,Recalibration of Perceived Distance in Virtual Environments Occurs Rapidly and Transfers Asymmetrically Across Scale,"Distance in immersive virtual reality is commonly underperceived relative to intended distance, causing virtual environments to appear smaller than they actually are. However, a brief period of interaction by walking through the virtual environment with visual feedback can cause dramatic improvement in perceived distance. The goal of the current project was to determine how quickly improvement occ...","Jonathan W. Kelly,William W. Hammel,Zachary D. Siegel,Lori A. Sjolund,",https://ieeexplore.ieee.org/document/6777445/
2014,No Sessions,Dynamic Affordances in Embodied Interactive Systems: The Role of Display and Mode of Locomotion,"We investigated how the properties of interactive virtual reality systems affect user behavior in full-body embodied interactions. Our experiment compared four interactive virtual reality systems using different display types (CAVE vs. HMD) and modes of locomotion (walking vs. joystick). Participants performed a perceptual-motor coordination task, in which they had to choose among a series of oppo...","Timofey Y. Grechkin,Jodie M. Plumert,Joseph K. Kearney,",https://ieeexplore.ieee.org/document/6777453/
2014,No Sessions,Feasibility of Training Athletes for High-Pressure Situations Using Virtual Reality,"Virtual reality (VR) has been successfully applied to a broad range of training domains; however, to date there is little research investigating its benefits for sport psychology training. We hypothesized that using high-fidelity VR systems to display realistic 3D sport environments could trigger anxiety, allowing resilience-training systems to prepare athletes for real-world, high-pressure situat...","Cheryl Stinson,Doug A. Bowman,",https://ieeexplore.ieee.org/document/6777452/
2014,No Sessions,Measuring Latency in Virtual Environments,"Latency of interactive computer systems is a product of the processing, transport and synchronisation delays inherent to the components that create them. In a virtual environment (VE) system, latency is known to be detrimental to a user's sense of immersion, physical performance and comfort level. Accurately measuring the latency of a VE system for study or optimisation, is not straightforward. A ...","Sebastian Friston,Anthony Steed,",https://ieeexplore.ieee.org/document/6777458/
2014,No Sessions,Effects of Virtual Human Animation on Emotion Contagion in Simulated Inter-Personal Experiences,"We empirically examined the impact of virtual human animation on the emotional responses of participants in a medical virtual reality system for education in the signs and symptoms of patient deterioration. Participants were presented with one of two virtual human conditions in a between-subjects experiment, static (non-animated) and dynamic (animated). Our objective measures included the use of p...","Yanxiang Wu,Sabarish V. Babu,Rowan Armstrong,Jeffrey W. Bertrand,Jun Luo,Tania Roy,Shaundra B. Daily,Lauren Cairco Dukes,Larry F. Hodges,Tracy Fasolino,",https://ieeexplore.ieee.org/document/6777428/
2014,No Sessions,Getting the Point Across: Exploring the Effects of Dynamic Virtual Humans in an Interactive Museum Exhibit on User Perceptions,"We have created “You, M.D.”, an interactive museum exhibit in which users learn about topics in public health literacy while interacting with virtual humans. You, M.D. is equipped with a weight sensor, a height sensor and a Microsoft Kinect that gather basic user information. Conceptually, You, M.D. could use this user information to dynamically select the appearance of the virtual humans in the i...","Diego Rivera-Gutierrez,Rick Ferdig,Jian Li,Benjamin Lok,",https://ieeexplore.ieee.org/document/6777429/
2014,No Sessions,Exchange of Avatars: Toward a Better Perception and Understanding,"The exchange of avatars, i.e. the actual fact of changing once avatar with another one, is a promising trend in multi-actor virtual environments. It provides new opportunities for users, such as controlling a different avatar for a specific action, retrieving knowledge belonging to a particular avatar, solving conflicts and deadlocks situations or even helping another user. Virtual Environments fo...","Thomas Lopez,Rozenn Bouville,Emilie Loup-escande,Florian Nouviale,Valérie Gouranton,Bruno Arnaldi,",https://ieeexplore.ieee.org/document/6777431/
2014,No Sessions,A Modular Degree-of-Interest Specification for the Visual Analysis of Large Dynamic Networks,"Large dynamic networks are targets of analysis in many fields. Tracking temporal changes at scale in these networks is challenging due in part to the fact that small changes can be missed or drowned-out by the rest of the network. For static networks, current approaches allow the identification of specific network elements within their context. However, in the case of dynamic networks, the user is...","James Abello,Steffen Hadlak,Heidrun Schumann,Hans-Jörg Schulz,",https://ieeexplore.ieee.org/document/6574858/
2014,No Sessions,A Structure-Based Distance Metric for High-Dimensional Space Exploration with Multidimensional Scaling,"Although the euclidean distance does well in measuring data distances within high-dimensional clusters, it does poorly when it comes to gauging intercluster distances. This significantly impacts the quality of global, low-dimensional space embedding procedures such as the popular multidimensional scaling (MDS) where one can often observe nonintuitive layouts. We were inspired by the perceptual pro...","Jenny Hyunjung Lee,Kevin T. McDonnell,Alla Zelenyuk,Dan Imre,Klaus Mueller,",https://ieeexplore.ieee.org/document/6560006/
2014,No Sessions,A Task Taxonomy for Network Evolution Analysis,"Visualization has proven to be a useful tool for understanding network structures. Yet the dynamic nature of social media networks requires powerful visualization techniques that go beyond static network diagrams. To provide strong temporal network visualization tools, designers need to understand what tasks the users have to accomplish. This paper describes a taxonomy of temporal network visualiz...","Jae-wook Ahn,Catherine Plaisant,Ben Shneiderman,",https://ieeexplore.ieee.org/document/6620874/
2014,No Sessions,Activity Detection in Scientific Visualization,"For large-scale simulations, the data sets are so massive that it is sometimes not feasible to view the data with basic visualization methods, let alone explore all time steps in detail. Automated tools are necessary for knowledge discovery, i.e., to help sift through the data and isolate specific time steps that can then be further explored. Scientists study patterns and interactions and want to ...","Sedat Ozer,Deborah Silver,Karen Bemis,Pino Martin,",https://ieeexplore.ieee.org/document/6583163/
2014,No Sessions,An Evaluation of Depth Enhancing Perceptual Cues for Vascular Volume Visualization in Neurosurgery,"Cerebral vascular images obtained through angiography are used by neurosurgeons for diagnosis, surgical planning, and intraoperative guidance. The intricate branching of the vessels and furcations, however, make the task of understanding the spatial three-dimensional layout of these images challenging. In this paper, we present empirical studies on the effect of different perceptual cues (fog, pse...","Marta Kersten-Oertel,Sean Jy-Shyang Chen,D. Louis Collins,",https://ieeexplore.ieee.org/document/6620865/
2014,No Sessions,Attributes of Subtle Cues for Facilitating Visual Search in Augmented Reality,"Goal-oriented visual search is performed when a person intentionally seeks a target in the visual environment. In augmented reality (AR) environments, visual search can be facilitated by augmenting virtual cues in the person's field of view. Traditional use of explicit AR cues can potentially degrade visual search performance due to the creation of distortions in the scene. An alternative to expli...","Weiquan Lu,Henry Been-Lirn Duh,Steven Feiner,Qi Zhao,",https://ieeexplore.ieee.org/document/6620869/
2014,No Sessions,FaceWarehouse: A 3D Facial Expression Database for Visual Computing,"We present FaceWarehouse, a database of 3D facial expressions for visual computing applications. We use Kinect, an off-the-shelf RGBD camera, to capture 150 individuals aged 7-80 from various ethnic backgrounds. For each person, we captured the RGBD data of her different expressions, including the neutral expression and 19 other expressions such as mouth-opening, smile, kiss, etc. For every RGBD r...","Chen Cao,Yanlin Weng,Shun Zhou,Yiying Tong,Kun Zhou,",https://ieeexplore.ieee.org/document/6654137/
2014,No Sessions,Implicit Incompressible SPH,"We propose a novel formulation of the projection method for Smoothed Particle Hydrodynamics (SPH). We combine a symmetric SPH pressure force and an SPH discretization of the continuity equation to obtain a discretized form of the pressure Poisson equation (PPE). In contrast to previous projection schemes, our system does consider the actual computation of the pressure force. This incorporation imp...","Markus Ihmsen,Jens Cornelis,Barbara Solenthaler,Christopher Horvath,Matthias Teschner,",https://ieeexplore.ieee.org/document/6570475/
2014,No Sessions,Optimized Synthesis of Art Patterns and Layered Textures,"Line drawings and digital arts appear everywhere, from simple icons and logos to cartoons, maps, and illustrations. We define art patterns as the subset of line drawings and digital arts that are comprised of repeated elements. There exist textures that share characteristics with art patterns. Examples of such textures include piled discrete elements with curved contours. Inspired by recent succes...","Ruobing Wu,Wenping Wang,Yizhou Yu,",https://ieeexplore.ieee.org/document/6579613/
2014,No Sessions,Scalable Collision Detection Using p-Partition Fronts on Many-Core Processors,"We present a new parallel algorithm for collision detection using many-core computing platforms of CPUs or GPUs. Based on the notion of a p-partition front, our algorithm is able to evenly partition and distribute the workload of BVH traversal among multiple processing cores without the need for dynamic balancing, while minimizing the memory overhead inherent to the state-of-the-art parallel colli...","Xinyu Zhang,Young J. Kim,",https://ieeexplore.ieee.org/document/6620867/
2014,No Sessions,Similarity Preserving Snippet-Based Visualization of Web Search Results,"Internet users are very familiar with the results of a search query displayed as a ranked list of snippets. Each textual snippet shows a content summary of the referred document (or webpage) and a link to it. This display has many advantages, for example, it affords easy navigation and is straightforward to interpret. Nonetheless, any user of search engines could possibly report some experience of...","Erick Gomez-Nieto,Frizzi San Roman,Paulo Pagliosa,Wallace Casaca,Elias S. Helou,Maria Cristina F. de Oliveira,Luis Gustavo Nonato,",https://ieeexplore.ieee.org/document/6629989/
