year,session,title,abstract,author,doi
2009,No Sessions,[Front cover],No Abstract,,https://ieeexplore.ieee.orgNo doi
2009,No Sessions,[Inside front cover],No Abstract,,https://ieeexplore.ieee.orgNo doi
2009,No Sessions,TVCG Vis/InfoVis 2009 Front Matter,No Abstract,,https://ieeexplore.ieee.org/document/5290689/
2009,No Sessions,ABySS-Explorer: Visualizing Genome Sequence Assemblies,One bottleneck in large-scale genome sequencing projects is reconstructing the full genome sequence from the short subsequences produced by current technologies. The final stages of the genome assembly process inevitably require manual inspection of data inconsistencies and could be greatly aided by visualization. This paper presents our design decisions in translating key data features identified...,"Cydney B. Nielsen,Shaun D. Jackman,Inanç Birol,Steven J.M. Jones,",https://ieeexplore.ieee.org/document/5290690/
2009,No Sessions,Constructing Overview + Detail Dendrogram-Matrix Views,"A dendrogram that visualizes a clustering hierarchy is often integrated with a re-orderable matrix for pattern identification. The method is widely used in many research fields including biology, geography, statistics, and data mining. However, most dendrograms do not scale up well, particularly with respect to problems of graphical and cognitive information overload. This research proposes a stra...","Jin Chen,Alan M. MacEachren,Donna J. Peuquet,",https://ieeexplore.ieee.org/document/5290691/
2009,No Sessions,MizBee: A Multiscale Synteny Browser,"In the field of comparative genomics, scientists seek to answer questions about evolution and genomic function by comparing the genomes of species to find regions of shared sequences. Conserve dsyntenic blocks are an important biological data abstraction for indicating regions of shared sequences. The goal of this work is to show multiple types of relationships at multiple scales in a way that is ...","Miriah Meyer,Tamara Munzner,Hanspeter Pfister,",https://ieeexplore.ieee.org/document/5290692/
2009,No Sessions,GeneShelf: A Web-based Visual Interface for Large Gene Expression Time-Series Data Repositories,"A widespread use of high-throughput gene expression analysis techniques enabled the biomedical research community to share a huge body of gene expression datasets in many public databases on the web. However, current gene expression data repositories provide static representations of the data and support limited interactions. This hinders biologists from effectively exploring shared gene expressio...","Bohyoung Kim,Bongshin Lee,Susan Knoblach,Eric Hoffman,Jinwook Seo,",https://ieeexplore.ieee.org/document/5290693/
2009,No Sessions,Spatiotemporal Analysis of Sensor Logs using Growth Ring Maps,"Spatiotemporal analysis of sensor logs is a challenging research field due to three facts: a) traditional two-dimensional maps do not support multiple events to occur at the same spatial location, b) three-dimensional solutions introduce ambiguity and are hard to navigate, and c) map distortions to solve the overlap problem are unfamiliar to most users. This paper introduces a novel approach to re...","Peter Bak,Florian Mansmann,Halldor Janetzko,Daniel Keim,",https://ieeexplore.ieee.org/document/5290694/
2009,No Sessions,A Nested Model for Visualization Design and Validation,"We present a nested model for the visualization design and validation with four layers: characterize the task and data in the vocabulary of the problem domain, abstract into operations and data types, design visual encoding and interaction techniques, and create algorithms to execute techniques efficiently. The output from a level above is input to the level below, bringing attention to the design...","Tamara Munzner,",https://ieeexplore.ieee.org/document/5290695/
2009,No Sessions,Conjunctive Visual Forms,Visual exploration of multidimensional data is a process of isolating and extracting relationships within and between dimensions. Coordinated multiple view approaches are particularly effective for visual exploration because they support precise expression of heterogeneous multidimensional queries using simple interactions. Recent visual analytics research has made significant progress in identify...,"Chris Weaver,",https://ieeexplore.ieee.org/document/5290696/
2009,No Sessions,Interaction Techniques for Selecting and Manipulating Subgraphs in Network Visualizations,"We present a novel and extensible set of interaction techniques for manipulating visualizations of networks by selecting subgraphs and then applying various commands to modify their layout or graphical properties. Our techniques integrate traditional rectangle and lasso selection, and also support selecting a node's neighbourhood by dragging out its radius (in edges) using a novel kind of radial m...","Michael J. McGuffin,Igor Jurisica,",https://ieeexplore.ieee.org/document/5290697/
2009,No Sessions,ActiviTree: Interactive Visual Exploration of Sequences in Event-Based Data Using Graph Similarity,"The identification of significant sequences in large and complex event-based temporal data is a challenging problem with applications in many areas of today's information intensive society. Pure visual representations can be used for the analysis, but are constrained to small data sets. Algorithmic search mechanisms used for larger data sets become expensive as the data size increases and typicall...","Katerina Vrotsou,Jimmy Johansson,Matthew Cooper,",https://ieeexplore.ieee.org/document/5290698/
2009,No Sessions,"“Search, Show Context, Expand on Demand”: Supporting Large Graph Exploration with Degree-of-Interest","A common goal in graph visualization research is the design of novel techniques for displaying an overview of an entire graph. However, there are many situations where such an overview is not relevant or practical for users, as analyzing the global structure may not be related to the main task of the users that have semi-specific information needs. Furthermore, users accessing large graph database...","Frank van Ham,Adam Perer,",https://ieeexplore.ieee.org/document/5290699/
2009,No Sessions,A Comparison of User-Generated and Automatic Graph Layouts,"The research presented in this paper compares user-generated and automatic graph layouts. Following the methods suggested by van Ham et al. (2008), a group of users generated graph layouts using both multi-touch interaction on a tabletop display and mouse interaction on a desktop computer. Users were asked to optimize their layout for aesthetics and analytical tasks with a social network. We discu...","Tim Dwyer,Bongshin Lee,Danyel Fisher,Kori Inkpen Quinn,Petra Isenberg,George Robertson,Chris North,",https://ieeexplore.ieee.org/document/5290700/
2009,No Sessions,Smooth Graphs for Visual Exploration of Higher-Order State Transitions,"In this paper, we present a new visual way of exploring state sequences in large observational time-series. A key advantage of our method is that it can directly visualize higher-order state transitions. A standard first order state transition is a sequence of two states that are linked by a transition. A higher-order state transition is a sequence of three or more states where the sequence of par...","Jorik Blaas,Charl Botha,Edward Grundy,Mark Jones,Robert Laramee,Frits Post,",https://ieeexplore.ieee.org/document/5290701/
2009,No Sessions,Configuring Hierarchical Layouts to Address Research Questions,"We explore the effects of selecting alternative layouts in hierarchical displays that show multiple aspects of large multivariate datasets, including spatial and temporal characteristics. Hierarchical displays of this type condition a dataset by multiple discrete variable values, creating nested graphical summaries of the resulting subsets in which size, shape and colour can be used to show subset...","Aidan Slingsby,Jason Dykes,Jo Wood,",https://ieeexplore.ieee.org/document/5290702/
2009,No Sessions,Visualizing Social Photos on a Hasse Diagram for Eliciting Relations and Indexing New Photos,"Social photos, which are taken during family events or parties, represent individuals or groups of people. We show in this paper how a Hasse diagram is an efficient visualization strategy for eliciting different groups and navigating through them. However, we do not limit this strategy to these traditional uses. Instead we show how it can also be used for assisting in indexing new photos. Indexing...","Michel Crampes,Jeremy de Oliveira-Kumar,Sylvie Ranwez,Jean Villerd,",https://ieeexplore.ieee.org/document/5290703/
2009,No Sessions,Interactive Dimensionality Reduction Through User-defined Combinations of Quality Metrics,"Multivariate data sets including hundreds of variables are increasingly common in many application areas. Most multivariate visualization techniques are unable to display such data effectively, and a common approach is to employ dimensionality reduction prior to visualization. Most existing dimensionality reduction systems focus on preserving one or a few significant structures in data. For many a...","Sara Johansson,Jimmy Johansson,",https://ieeexplore.ieee.org/document/5290704/
2009,No Sessions,Scattering Points in Parallel Coordinates,"In this paper, we present a novel parallel coordinates design integrated with points (scattering points in parallel coordinates, SPPC), by taking advantage of both parallel coordinates and scatterplots. Different from most multiple views visualization frameworks involving parallel coordinates where each visualization type occupies an individual window, we convert two selected neighboring coordinat...","Xiaoru Yuan,Peihong Guo,He Xiao,Hong Zhou,Huamin Qu,",https://ieeexplore.ieee.org/document/5290705/
2009,No Sessions,Bubble Sets: Revealing Set Relations with Isocontours over Existing Visualizations,"While many data sets contain multiple relationships, depicting more than one data relationship within a single visualization is challenging. We introduce Bubble Sets as a visualization technique for data that has both a primary data relation with a semantically significant spatial organization and a significant set membership relation in which members of the same set are not necessarily adjacent i...","Christopher Collins,Gerald Penn,Sheelagh Carpendale,",https://ieeexplore.ieee.org/document/5290706/
2009,No Sessions,FromDaDy: Spreading Aircraft Trajectories Across Views to Support Iterative Queries,"When displaying thousands of aircraft trajectories on a screen, the visualization is spoiled by a tangle of trails. The visual analysis is therefore difficult, especially if a specific class of trajectories in an erroneous dataset has to be studied. We designed FromDaDy, a trajectory visualization tool that tackles the difficulties of exploring the visualization of multiple trails. This multidimen...","Christophe Hurter,Benjamin Tissoires,Stéphane Conversy,",https://ieeexplore.ieee.org/document/5290707/
2009,No Sessions,SellTrend: Inter-Attribute Visual Analysis of Temporal Transaction Data,"We present a case study of our experience designing SellTrend, a visualization system for analyzing airline travel purchase requests. The relevant transaction data can be characterized as multi-variate temporal and categorical event sequences, and the chief problem addressed is how to help company analysts identify complex combinations of transaction attributes that contribute to failed purchase r...","Zhicheng Liu,John Stasko,Timothy Sullivan,",https://ieeexplore.ieee.org/document/5290708/
2009,No Sessions,Comparing Dot and Landscape Spatializations for Visual Memory Differences,"Spatialization displays use a geographic metaphor to arrange non-spatial data. For example, spatializations are commonly applied to document collections so that document themes appear as geographic features such as hills. Many common spatialization interfaces use a 3-D landscape metaphor to present data. However, it is not clear whether 3-D spatializations afford improved speed and accuracy for us...","Melanie Tory,Colin Swindells,Rebecca Dreezer,",https://ieeexplore.ieee.org/document/5290709/
2009,No Sessions,Flow Mapping and Multivariate Visualization of Large Spatial Interaction Data,"Spatial interactions (or flows), such as population migration and disease spread, naturally form a weighted location-to-location network (graph). Such geographically embedded networks (graphs) are usually very large. For example, the county-to-county migration data in the U.S. has thousands of counties and about a million migration paths. Moreover, many variables are associated with each flow, suc...","Diansheng Guo,",https://ieeexplore.ieee.org/document/5290710/
2009,No Sessions,"Temporal Summaries: Supporting Temporal Categorical Searching, Aggregation and Comparison","When analyzing thousands of event histories, analysts often want to see the events as an aggregate to detect insights and generate new hypotheses about the data. An analysis tool must emphasize both the prevalence and the temporal ordering of these events. Additionally, the analysis tool must also support flexible comparisons to allow analysts to gather visual evidence. In a previous work, we intr...","Taowei David Wang,Catherine Plaisant,Ben Shneiderman,Neil Spring,David Roseman,Greg Marchand,Vikramjit Mukherjee,Mark Smith,",https://ieeexplore.ieee.org/document/5290711/
2009,No Sessions,[Front cover],No Abstract,,https://ieeexplore.ieee.orgNo doi
2009,No Sessions,[Inside front cover],No Abstract,,https://ieeexplore.ieee.orgNo doi
2009,No Sessions,The 15th Anniversary of the IEEE Transactions on Visualization and Computer Graphics: Celebrating a Success Story,No Abstract,"Arie E. Kaufman,Hans Hagen,David S. Ebert,",https://ieeexplore.ieee.org/document/5165580/
2009,No Sessions,Editor’s Note,No Abstract,"Thomas Ertl,",https://ieeexplore.ieee.org/document/5165581/
2009,No Sessions,Case Study on Visualizing Hurricanes Using Illustration-Inspired Techniques,"The devastating power of hurricanes was evident during the 2005 hurricane season, the most active season on record. This has prompted increased efforts by researchers to understand the physical processes that underlie the genesis, intensification, and tracks of hurricanes. This research aims at facilitating an improved understanding into the structure of hurricanes with the aid of visualization te...","Alark Joshi,Jesus Caban,Penny Rheingans,Lynn Sparling,",https://ieeexplore.ieee.org/document/4624255/
2009,No Sessions,Planetary-Scale Terrain Composition,"Many interrelated planetary height map and surface image map data sets exist, and more data are collected each day. Broad communities of scientists require tools to compose these data interactively and explore them via real-time visualization. While related, these data sets are often unregistered with one another, having different projection, resolution, format, and type. We present a GPU-centric ...","Robert Kooima,Jason Leigh,Andrew Johnson,Doug Roberts,Mark SubbaRao,Thomas A. DeFanti,",https://ieeexplore.ieee.org/document/4840339/
2009,No Sessions,Distribution-Driven Visualization of Volume Data,"Feature detection and display are the essential goals of the visualization process. Most visualization software achieves these goals by mapping properties of sampled intensity values and their derivatives to color and opacity. In this work, we propose to explicitly study the local frequency distribution of intensity values in broader neighborhoods centered around each voxel. We have found frequenc...","C. Ryan Johnson,Jian Huang,",https://ieeexplore.ieee.org/document/4775894/
2009,No Sessions,Enhancing Realism of Wet Surfaces in Temporal Bone Surgical Simulation,"We present techniques to improve visual realism in an interactive surgical simulation application: a mastoidectomy simulator that offers a training environment for medical residents as a complement to using a cadaver. As well as displaying the mastoid bone through volume rendering, the simulation allows users to experience haptic feedback and appropriate sound cues while controlling a virtual bone...","Thomas Kerwin,Han-Wei Shen,Don Stredney,",https://ieeexplore.ieee.org/document/4796193/
2009,No Sessions,A Survey of Radial Methods for Information Visualization,"Radial visualization, or the practice of displaying data in a circular or elliptical pattern, is an increasingly common technique in information visualization research. In spite of its prevalence, little work has been done to study this visualization paradigm as a methodology in its own right. We provide a historical review of radial visualization, tracing it to its roots in centuries-old statisti...","Geoffrey M. Draper,Yarden Livnat,Richard F. Riesenfeld,",https://ieeexplore.ieee.org/document/4770098/
2009,No Sessions,Uncluttering Graph Layouts Using Anisotropic Diffusion and Mass Transport,"Many graph layouts include very dense areas, making the layout difficult to understand. In this paper, we propose a technique for modifying an existing layout in order to reduce the clutter in dense areas. A physically inspired evolution process based on a modified heat equation is used to create an improved layout density image, making better use of available screen space. Using results from opti...","Yaniv Frishman,Ayellet Tal,",https://ieeexplore.ieee.org/document/4967578/
2009,No Sessions,Efficient and Accurate Sound Propagation Using Adaptive Rectangular Decomposition,"Accurate sound rendering can add significant realism to complement visual display in interactive applications, as well as facilitate acoustic predictions for many engineering applications, like accurate acoustic analysis for architectural design (Monks et al., 2000). Numerical simulation can provide this realism most naturally by modeling the underlying physics of wave propagation. However, wave s...","Nikunj Raghuvanshi,Rahul Narain,Ming C. Lin,",https://ieeexplore.ieee.org/document/5165582/
2009,No Sessions,Efficient LBM Visual Simulation on Face-Centered Cubic Lattices,"The Lattice Boltzmann method (LBM) for visual simulation of fluid flow generally employs cubic Cartesian (CC) lattices such as the D3Q13 and D3Q19 lattices for the particle transport. However, the CC lattices lead to suboptimal representation of the simulation space. We introduce the face-centered cubic (FCC) lattice, fD3Q13, for LBM simulations. Compared to the CC lattices, the fD3Q13 lattice cre...","Kaloian Petkov,Feng Qiu,Zhe Fan,Arie E. Kaufman,Klaus Mueller,",https://ieeexplore.ieee.org/document/4796194/
2009,No Sessions,Image-Based Modeling of the Human Eye,"Rendering realistic organic materials is a challenging issue. The human eye is an important part of nonverbal communication which, consequently, requires specific modeling and rendering techniques to enhance the realism of virtual characters. We propose an image-based method for estimating both iris morphology and scattering features in order to generate convincing images of virtual eyes. In this ...","Guillaume Francois,Pascal Gautron,Gaspard Breton,Kadi Bouatouch,",https://ieeexplore.ieee.org/document/4770099/
2009,No Sessions,Refilming with Depth-Inferred Videos,"Compared to still image editing, content-based video editing faces the additional challenges of maintaining the spatiotemporal consistency with respect to geometry. This brings up difficulties of seamlessly modifying video content, for instance, inserting or removing an object. In this paper, we present a new video editing system for creating spatiotemporally consistent and visually appealing refi...","Guofeng Zhang,Zilong Dong,Jiaya Jia,Liang Wan,Tien-Tsin Wong,Hujun Bao,",https://ieeexplore.ieee.org/document/4906990/
2009,No Sessions,TransCAIP: A Live 3D TV System Using a Camera Array and an Integral Photography Display with Interactive Control of Viewing Parameters,"The system described in this paper provides a real-time 3D visual experience by using an array of 64 video cameras and an integral photography display with 60 viewing directions. The live 3D scene in front of the camera array is reproduced by the full-color, full-parallax autostereoscopic display with interactive control of viewing parameters. The main technical challenge is fast and flexible conv...","Yuichi Taguchi,Takafumi Koike,Keita Takahashi,Takeshi Naemura,",https://ieeexplore.ieee.org/document/4785464/
2009,No Sessions,Multiresolution Mean Shift Clustering Algorithm for Shape Interpolation,"In this paper, we solve the problem of 3D shape interpolation with significant pose variation. For an ideal 3D shape interpolation, especially the articulated model, the shape should follow the movement of the underlying articulated structure and be transformed in a way that is as rigid as possible. Given input shapes with compatible connectivity, we propose a novel multiresolution mean shift (MMS...","Hung-Kuo Chu,Tong-Yee Lee,",https://ieeexplore.ieee.org/document/4815234/
2009,No Sessions,Compatible Embedding for 2D Shape Animation,"We present new algorithms for the compatible embedding of 2D shapes. Such embeddings offer a convenient way to interpolate shapes having complex, detailed features. Compared to existing techniques, our approach requires less user input, and is faster, more robust, and simpler to implement, making it ideal for interactive use in practical applications. Our new approach consists of three parts. Firs...","William V. Baxter III,Pascal Barla,Ken-ichi Anjyo,",https://ieeexplore.ieee.org/document/4815232/
2009,No Sessions,VisWeek 09,No Abstract,,https://ieeexplore.ieee.org/document/5165583/
2009,No Sessions,TVCG Information for authors,No Abstract,,https://ieeexplore.ieee.orgNo doi
2009,No Sessions,[Back cover],No Abstract,,https://ieeexplore.ieee.orgNo doi
2009,No Sessions,[Front cover],No Abstract,,https://ieeexplore.ieee.orgNo doi
2009,No Sessions,[Inside front cover],No Abstract,,https://ieeexplore.ieee.orgNo doi
2009,No Sessions,"Guest Editor's Introduction: Special Section on Shape, Solid, and Physical Modeling",No Abstract,"Hong Qin,",https://ieeexplore.ieee.org/document/4917475/
2009,No Sessions,Performing Efficient NURBS Modeling Operations on the GPU,We present algorithms for evaluating and performing modeling operations on NURBS surfaces using the programmable fragment processor on the Graphics Processing Unit (GPU). We extend our GPU-based NURBS evaluator that evaluates NURBS surfaces to compute exact normals for either standard or rational B-spline surfaces for use in rendering and geometric modeling. We build on these calculations in our n...,"Adarsh Krishnamurthy,Rahul Khardekar,Sara McMains,Kirk Haller,Gershon Elber,",https://ieeexplore.ieee.org/document/4782957/
2009,No Sessions,ICCD: Interactive Continuous Collision Detection between Deformable Models Using Connectivity-Based Culling,"We present an interactive algorithm for continuous collision detection between deformable models. We introduce multiple techniques to improve the culling efficiency and the overall performance of continuous collision detection. First, we present a novel formulation for continuous normal cones and use these normal cones to efficiently cull large regions of the mesh as part of self-collision tests. ...","Min Tang,Sean Curtis,Sung-Eui Yoon,Dinesh Manocha,",https://ieeexplore.ieee.org/document/4745636/
2009,No Sessions,Surface Mapping Using Consistent Pants Decomposition,Surface mapping is fundamental to shape computing and various downstream applications. This paper develops a pants decomposition framework for computing maps between surfaces with arbitrary topologies. The framework first conducts pants decomposition on both surfaces to segment them into consistent sets of pants patches (a pants patch is intuitively defined as a genus-0 surface with three boundari...,"Xin Li,Xianfeng Gu,Hong Qin,",https://ieeexplore.ieee.org/document/4738453/
2009,No Sessions,Bandwidth Selection and Reconstruction Quality in Point-Based Surfaces,"We investigate the influence of bandwidth selection in the reconstruction quality of point-based surfaces. While the problem has received relatively little attention in the literature, we show that appropriate selection plays a significant role in the quality of reconstructed surfaces. We show how to compute optimal bandwidths for one class of moving least-squares surfaces by formulating the polyn...","Hao Wang,Carlos E. Scheidegger,Cláudio T. Silva,",https://ieeexplore.ieee.org/document/4745637/
2009,No Sessions,A Minimal Contouring Approach to the Computation of the Reeb Graph,"Given a manifold surface M and a continuous scalar function f:Mrarr IR, the Reeb graph of (M, f) is a widely used high-level descriptor of M and its usefulness has been demonstrated for a variety of applications, which range from shape parameterization and abstraction to deformation and comparison. In this context, we propose a novel contouring algorithm for the construction of a discrete Reeb gra...","Giuseppe Patane,Michela Spagnuolo,Bianca Falcidieno,",https://ieeexplore.ieee.org/document/4770097/
2009,No Sessions,An Efficient Solution to Systems of Multivariate Polynomial Using Expression Trees,"In recent years, several quite successful attempts have been made to solve systems of polynomial constraints, using geometric design tools, exploiting the availability of subdivision-based solvers [7], [11], [12], [15]. This broad range of methods includes both binary domain subdivision as well as the projected polyhedron method of Sherbrooke and Patrikalakis [15]. A prime obstacle in using subdiv...","Gershon Elber,Tom Grandine,",https://ieeexplore.ieee.org/document/4815236/
