year,session,title,abstract,author,doi
2017,No Sessions,Analytic Approximations for Real-Time Area Light Shading,"We introduce analytic approximations for accurate real-time rendering of surfaces lit by non-occluded area light sources. Our solution leverages the Irradiance Tensors developed by Arvo for the shading of Phong surfaces lit by a polygonal light source. Using a reformulation of the 1D boundary edge integral, we develop a general framework for approximating and evaluating the integral in constant ti...","Pascal Lecocq,Arthur Dufay,Gaël Sourimant,Jean-Eudes Marvie,",https://ieeexplore.ieee.org/document/7829413/
2017,No Sessions,Sequential Monte Carlo Instant Radiosity,"Instant Radiosity and its derivatives are interactive methods for efficiently estimating global (indirect) illumination. They represent the last indirect bounce of illumination before the camera as the composite radiance field emitted by a set of virtual point light sources (VPLs). In complex scenes, current algorithms suffer from a difficult combination of two issues: it remains a challenge to di...","Peter Hedman,Tero Karras,Jaakko Lehtinen,",https://ieeexplore.ieee.org/document/7867077/
2017,No Sessions,Trending Paths: A New Semantic-Level Metric for Comparing Simulated and Real Crowd Data,"We propose a new semantic-level crowd evaluation metric in this paper. Crowd simulation has been an active and important area for several decades. However, only recently has there been an increased focus on evaluating the fidelity of the results with respect to real-world situations. The focus to date has been on analyzing the properties of low-level features such as pedestrian trajectories, or gl...","He Wang,Jan Ondřej,Carol O’Sullivan,",https://ieeexplore.ieee.org/document/7797248/
2017,No Sessions,Phenomenological Transparency,"Translucent objects such as fog, clouds, smoke, glass, ice, and liquids are pervasive in cinematic environments because they frame scenes in depth and create visually-compelling shots. Unfortunately, they are hard to render in real-time and have thus previously been rendered poorly compared to opaque surfaces. This paper introduces the first model for a real-time rasterization algorithm that can s...","Morgan McGuire,Michael Mara,",https://ieeexplore.ieee.org/document/7828148/
2017,No Sessions,A Unified Detail-Preserving Liquid Simulation by Two-Phase Lattice Boltzmann Modeling,"Traditional methods in graphics to simulate liquid-air dynamics under different scenarios usually employ separate approaches with sophisticated interface tracking/reconstruction techniques. In this paper, we propose a novel unified approach which is easy and effective to produce a variety of liquid-air interface phenomena. These phenomena, such as complex surface splashes, bubble interactions, as ...","Yulong Guo,Xiaopei Liu,Xuemiao Xu,",https://ieeexplore.ieee.org/document/7414526/
2017,No Sessions,Analyzing Eye-Tracking Information in Visualization and Data Space: From Where on the Screen to What on the Screen,"Eye-tracking data is currently analyzed in the image space that gaze-coordinates were recorded in, generally with the help of overlays such as heatmaps or scanpaths, or with the help of manually defined areas of interest (AOI). Such analyses, which focus predominantly on where on the screen users are looking, require significant manual input and are not feasible for studies involving many subjects...","Sayeed Safayet Alam,Radu Jianu,",https://ieeexplore.ieee.org/document/7420740/
2017,No Sessions,Embedding Spatio-Temporal Information into Maps by Route-Zooming,"Analysis and exploration of spatio-temporal data such as traffic flow and vehicle trajectories have become important in urban planning and management. In this paper, we present a novel visualization technique called route-zooming that can embed spatio-temporal information into a map seamlessly for occlusion-free visualization of both spatial and temporal data. The proposed technique can broaden a ...","Guodao Sun,Ronghua Liang,Huamin Qu,Yingcai Wu,",https://ieeexplore.ieee.org/document/7420745/
2017,No Sessions,Extrafoveal Video Extension for an Immersive Viewing Experience,"Between the recent popularity of virtual reality (VR) and the development of 3D, immersion has become an integral part of entertainment concepts. Head-mounted Display (HMD) devices are often used to afford users a feeling of immersion in the environment. Another technique is to project additional material surrounding the viewer, as is achieved using cave systems. As a continuation of this techniqu...","Laura Turban,Fabrice Urban,Philippe Guillotel,",https://ieeexplore.ieee.org/document/7404057/
2017,No Sessions,Generating Ambiguous Figure-Ground Images,"Ambiguous figure-ground images, mostly represented as binary images, are fascinating as they present viewers a visual phenomena of perceiving multiple interpretations from a single image. In one possible interpretation, the white region is seen as a foreground figure while the black region is treated as shapeless background. Such perception can reverse instantly at any moment. In this paper, we in...","Ying-Miao Kuo,Hung-Kuo Chu,Ming-Te Chi,Ruen-Rone Lee,Tong-Yee Lee,",https://ieeexplore.ieee.org/document/7420730/
2017,No Sessions,Improving Separability of Structures with Similar Attributes in 2D Transfer Function Design,"The 2D transfer function based on scalar value and gradient magnitude (SG-TF) is popularly used in volume rendering. However, it is plagued by the boundary-overlapping problem: different structures with similar attributes have the same region in SG-TF space, and their boundaries are usually connected. The SG-TF thus often fails in separating these structures (or their boundaries) and has limited a...","Shouren Lan,Lisheng Wang,Yipeng Song,Yu-ping Wang,Liping Yao,Kun Sun,Bin Xia,Zongben Xu,",https://ieeexplore.ieee.org/document/7423790/
2017,No Sessions,PlenoPatch: Patch-Based Plenoptic Image Manipulation,"Patch-based image synthesis methods have been successfully applied for various editing tasks on still images, videos and stereo pairs. In this work we extend patch-based synthesis to plenoptic images captured by consumer-level lenselet-based devices for interactive, efficient light field editing. In our method the light field is represented as a set of images captured from different viewpoints. We...","Fang-Lue Zhang,Jue Wang,Eli Shechtman,Zi-Ye Zhou,Jia-Xin Shi,Shi-Min Hu,",https://ieeexplore.ieee.org/document/7414488/
2017,No Sessions,IEEE,No Abstract,,https://ieeexplore.ieee.orgNo doi
2017,No Sessions,Contents,No Abstract,,https://ieeexplore.ieee.orgNo doi
2017,No Sessions,Introducing the IEEE Virtual Reality 2017 Special Issue,"The papers in this special issue were presented at the IEEE Virtual Reality (VR) Conference that was held in Los Angeles, CA, from March 18-22, 2017. ","Leila De Floriani,Dieter Schmalstieg,",https://ieeexplore.ieee.org/document/7878159/
2017,No Sessions,Preface,No Abstract,,https://ieeexplore.ieee.org/document/7876888/
2017,No Sessions,IEEE Visualization and Graphics Technical Committee (VGTC),No Abstract,"Claudio T. Silva,",https://ieeexplore.ieee.org/document/7876894/
2017,No Sessions,Conference Committee,No Abstract,,https://ieeexplore.ieee.orgNo doi
2017,No Sessions,International Program Committee,No Abstract,,https://ieeexplore.ieee.orgNo doi
2017,No Sessions,Papers Reviewers,No Abstract,,https://ieeexplore.ieee.orgNo doi
2017,No Sessions,The 2016 VGTC Virtual Reality: Best Dissertation Award,"The 2016 IEEE VGTC Virtual Reality Best Dissertation Award goes to Ravish Mehra, a 2014 graduate from the University of North Carolina at Chapel Hill, for his dissertation entitled: “Efficient Techniques for Wave-Based Sound Propagation in Interactive Applications”.","Ravish Mehra,",https://ieeexplore.ieee.org/document/7878158/
2017,No Sessions,Earthquake Safety Training through Virtual Drills,"Recent popularity of consumer-grade virtual reality devices, such as the Oculus Rift and the HTC Vive, has enabled household users to experience highly immersive virtual environments. We take advantage of the commercial availability of these devices to provide an immersive and novel virtual reality training approach, designed to teach individuals how to survive earthquakes, in common indoor enviro...","Changyang Li,Wei Liang,Chris Quigley,Yibiao Zhao,Lap-Fai Yu,",https://ieeexplore.ieee.org/document/7829397/
2017,No Sessions,Shifty: A Weight-Shifting Dynamic Passive Haptic Proxy to Enhance Object Perception in Virtual Reality,We define the concept of Dynamic Passive Haptic Feedback (DPHF) for virtual reality by introducing the weight-shifting physical DPHF proxy object Shifty. This concept combines actuators known from active haptics and physical proxies known from passive haptics to construct proxies that automatically adapt their passive haptic feedback. We describe the concept behind our ungrounded weight-shifting D...,"André Zenner,Antonio Krüger,",https://ieeexplore.ieee.org/document/7833030/
2017,No Sessions,The Problem of Persistence with Rotating Displays,"Motion-to-photon latency causes images to sway from side to side in a VR/AR system, while display persistence causes smearing; both of these are undesirable artifacts. We show that once latency is reduced or eliminated, smearing due to display persistence becomes the dominant visual artifact, even with accurate tracker prediction. We investigate the human perceptual mechanisms responsible for this...","Matthew Regan,Gavin S. P. Miller,",https://ieeexplore.ieee.org/document/7829409/
2017,No Sessions,Emulation of Physician Tasks in Eye-Tracked Virtual Reality for Remote Diagnosis of Neurodegenerative Disease,"For neurodegenerative conditions like Parkinson's disease, early and accurate diagnosis is still a difficult task. Evaluations can be time consuming, patients must often travel to metropolitan areas or different cities to see experts, and misdiagnosis can result in improper treatment. To date, only a handful of assistive or remote methods exist to help physicians evaluate patients with suspected n...","Jason Orlosky,Yuta Itoh,Maud Ranchet,Kiyoshi Kiyokawa,John Morgan,Hannes Devos,",https://ieeexplore.ieee.org/document/7829437/
2017,No Sessions,Altering User Movement Behaviour in Virtual Environments,"In immersive Virtual Reality systems, users tend to move in a Virtual Environment as they would in an analogous physical environment. In this work, we investigated how user behaviour is affected when the Virtual Environment differs from the physical space. We created two sets of four environments each, plus a virtual replica of the physical environment as a baseline. The first focused on aesthetic...","Adalberto L. Simeone,Ifigeneia Mavridou,Wendy Powell,",https://ieeexplore.ieee.org/document/7835276/
2017,No Sessions,Wide Field Of View Varifocal Near-Eye Display Using See-Through Deformable Membrane Mirrors,"Accommodative depth cues, a wide field of view, and ever-higher resolutions all present major hardware design challenges for near-eye displays. Optimizing a design to overcome one of these challenges typically leads to a trade-off in the others. We tackle this problem by introducing an all-in-one solution - a new wide field of view, gaze-tracked near-eye display for augmented reality applications....","David Dunn,Cary Tippets,Kent Torell,Petr Kellnhofer,Kaan Akşit,Piotr Didyk,Karol Myszkowski,David Luebke,Henry Fuchs,",https://ieeexplore.ieee.org/document/7829412/
2017,No Sessions,Efficient Hybrid Image Warping for High Frame-Rate Stereoscopic Rendering,Modern virtual reality simulations require a constant high-frame rate from the rendering engine. They may also require very low latency and stereo images. Previous rendering engines for virtual reality applications have exploited spatial and temporal coherence by using image-warping to re-use previous frames or to render a stereo pair at lower cost than running the full render pipeline twice. Howe...,"Andre Schollmeyer,Simon Schneegans,Stephan Beck,Anthony Steed,Bernd Froehlich,",https://ieeexplore.ieee.org/document/7833188/
2017,No Sessions,Semantic Entity-Component State Management Techniques to Enhance Software Quality for Multimodal VR-Systems,"Modularity, modifiability, reusability, and API usability are important software qualities that determine the maintainability of software architectures. Virtual, Augmented, and Mixed Reality (VR, AR, MR) systems, modern computer games, as well as interactive human-robot systems often include various dedicated input-, output-, and processing subsystems. These subsystems collectively maintain a real...","Martin Fischbach,Dennis Wiebusch,Marc Erich Latoschik,",https://ieeexplore.ieee.org/document/7829420/
2017,No Sessions,The Plausibility of a String Quartet Performance in Virtual Reality,We describe an experiment that explores the contribution of auditory and other features to the illusion of plausibility in a virtual environment that depicts the performance of a string quartet. `Plausibility' refers to the component of presence that is the illusion that the perceived events in the virtual environment are really happening. The features studied were: Gaze (the musicians ignored the...,"Ilias Bergström,Sérgio Azevedo,Panos Papiotis,Nuno Saldanha,Mel Slater,",https://ieeexplore.ieee.org/document/7835714/
2017,No Sessions,Scaled Jump in Gravity-Reduced Virtual Environments,"The reduced gravity experienced in lunar or Martian surfaces can be simulated on the earth using a cable-driven system, where the cable lifts a person to reduce his or her weight. This paper presents a novel cable-driven system designed for the purpose. It is integrated with a head-mounted display and a motion capture system. Focusing on jump motion within the system, this paper proposes to scale ...","MyoungGon Kim,Sunglk Cho,Tanh Quang Tran,Seong-Pil Kim,Ohung Kwon,JungHyun Han,",https://ieeexplore.ieee.org/document/7829423/
2017,No Sessions,A Psychophysical Experiment Regarding Components of the Plausibility Illusion,"We report on the design and results of an experiment investigating factors influencing Slater's Plausibility Illusion (Psi) in virtual environments (VEs). Slater proposed Psi and Place Illusion (PI) as orthogonal components of virtual experience which contribute to realistic response in a VE. PI corresponds to the traditional conception of presence as “being there,” so there exists a substantial b...","Richard Skarbez,Solène Neyret,Frederick P. Brooks,Mel Slater,Mary C. Whitton,",https://ieeexplore.ieee.org/document/7833192/
2017,No Sessions,MR360: Mixed Reality Rendering for 360° Panoramic Videos,This paper presents a novel immersive system called MR360 that provides interactive mixed reality (MR) experiences using a conventional low dynamic range (LDR) 360° panoramic video (360-video) shown in head mounted displays (HMDs). MR360 seamlessly composites 3D virtual objects into a live 360-video using the input panoramic video as the lighting source to illuminate the virtual objects. Image bas...,"Taehyun Rhee,Lohit Petikam,Benjamin Allen,Andrew Chalmers,",https://ieeexplore.ieee.org/document/7829404/
2017,No Sessions,Bending the Curve: Sensitivity to Bending of Curved Paths and Application in Room-Scale VR,"Redirected walking (RDW) promises to allow near-natural walking in an infinitely large virtual environment (VE) by subtle manipulations of the virtual camera. Previous experiments analyzed the human sensitivity to RDW manipulations by focusing on the worst-case scenario, in which users walk perfectly straight ahead in the VE, whereas they are redirected on a circular path in the real world. The re...","Eike Langbehn,Paul Lubos,Gerd Bruder,Frank Steinicke,",https://ieeexplore.ieee.org/document/7833190/
2017,No Sessions,The Martian: Examining Human Physical Judgments across Virtual Gravity Fields,"This paper examines how humans adapt to novel physical situations with unknown gravitational acceleration in immersive virtual environments. We designed four virtual reality experiments with different tasks for participants to complete: strike a ball to hit a target, trigger a ball to hit a target, predict the landing location of a projectile, and estimate the flight duration of a projectile. The ...","Tian Ye,Siyuan Qi,James Kubricht,Yixin Zhu,Hongjing Lu,Song-Chun Zhu,",https://ieeexplore.ieee.org/document/7829434/
2017,No Sessions,Designing a Vibrotactile Head-Mounted Display for Spatial Awareness in 3D Spaces,"Due to the perceptual characteristics of the head, vibrotactile Head-mounted Displays are built with low actuator density. Therefore, vibrotactile guidance is mostly assessed by pointing towards objects in the azimuthal plane. When it comes to multisensory interaction in 3D environments, it is also important to convey information about objects in the elevation plane. In this paper, we design and a...","Victor Adriel de Jesus Oliveira,Luca Brayda,Luciana Nedel,Anderson Maciel,",https://ieeexplore.ieee.org/document/7829406/
2017,No Sessions,Paint with Me: Stimulating Creativity and Empathy While Painting with a Painter in Virtual Reality,"While nothing can be more vivid, immediate and real than our own sensorial experiences, emerging virtual reality technologies are playing with the possibility of being able to share someone else's sensory reality. The Painter Project is a virtual environment where users see a video from a painter's point of view in tandem with a tracked rendering of their own hand while they paint on a physical ca...","Lynda Joy Gerry,",https://ieeexplore.ieee.org/document/7829415/
2017,No Sessions,Editor's Note,No Abstract,"Leila De Floriani,",https://ieeexplore.ieee.org/document/7835796/
2017,No Sessions,Guest Editor's Introduction: Special Section on the ACM SIGGRAPH/Eurographics Symposium on Computer Animation (SCA),No Abstract,,https://ieeexplore.ieee.org/document/7835799/
2017,No Sessions,Learning Inverse Rig Mappings by Nonlinear Regression,"We present a framework to design inverse rig-functions-functions that map low level representations of a character's pose such as joint positions or surface geometry to the representation used by animators called the animation rig. Animators design scenes using an animation rig, a framework widely adopted in animation production which allows animators to design character poses and geometry via int...","Daniel Holden,Jun Saito,Taku Komura,",https://ieeexplore.ieee.org/document/7742381/
2017,No Sessions,Functional Thin Films on Surfaces,"The motion of a thin viscous film of fluid on a curved surface exhibits many intricate visual phenomena, which are challenging to simulate using existing techniques. A possible alternative is to use a reduced model, involving only the temporal evolution of the mass density of the film on the surface. However, in this model, the motion is governed by a fourth-order nonlinear PDE, which involves geo...","Orestis Vantzos,Omri Azencot,Max Wardeztky,Martin Rumpf,Mirela Ben-Chen,",https://ieeexplore.ieee.org/document/7558232/
2017,No Sessions,Divergence-Free SPH for Incompressible and Viscous Fluids,"In this paper we present a novel Smoothed Particle Hydrodynamics (SPH) method for the efficient and stable simulation of incompressible fluids. The most efficient SPH-based approaches enforce incompressibility either on position or velocity level. However, the continuity equation for incompressible flow demands to maintain a constant density and a divergence-free velocity field. We propose a combi...","Jan Bender,Dan Koschier,",https://ieeexplore.ieee.org/document/7487018/
2017,No Sessions,Guest Editors Introduction: Special Section on the ACM Symposium on Virtual Reality Software and Technology 2015,No Abstract,"Lili Wang,Ming Lin,Enhua Wu,",https://ieeexplore.ieee.org/document/7835794/
2017,No Sessions,Optimal Camera Placement for Motion Capture Systems,"Optical motion capture is based on estimating the three-dimensional positions of markers by triangulation from multiple cameras. Successful performance depends on points being visible from at least two cameras and on the accuracy of the triangulation. Triangulation accuracy is strongly related to the positions and orientations of the cameras. Thus, the configuration of the camera network has a cri...","Pooya Rahimian,Joseph K. Kearney,",https://ieeexplore.ieee.org/document/7778256/
2017,No Sessions,JackIn Head: Immersive Visual Telepresence System with Omnidirectional Wearable Camera,"Sharing one's own immersive experience over the Internet is one of the ultimate goals of telepresence technology. In this paper, we present JackIn Head, a visual telepresence system featuring an omnidirectional wearable camera with image motion stabilization. Spherical omnidirectional video footage taken around the head of a local user is stabilized and then broadcast to others, allowing remote us...","Shunichi Kasahara,Shohei Nagai,Jun Rekimoto,",https://ieeexplore.ieee.org/document/7792698/
2017,No Sessions,Dynamic Projection Mapping onto Deforming Non-Rigid Surface Using Deformable Dot Cluster Marker,"Dynamic projection mapping for moving objects has attracted much attention in recent years. However, conventional approaches have faced some issues, such as the target objects being limited to rigid objects, and the limited moving speed of the targets. In this paper, we focus on dynamic projection mapping onto rapidly deforming non-rigid surfaces with a speed sufficiently high that a human does no...","Gaku Narita,Yoshihiro Watanabe,Masatoshi Ishikawa,",https://ieeexplore.ieee.org/document/7516689/
2017,No Sessions,Visualizing High-Dimensional Data: Advances in the Past Decade,"Massive simulations and arrays of sensing devices, in combination with increasing computing resources, have generated large, complex, high-dimensional datasets used to study phenomena across numerous fields of study. Visualization plays an important role in exploring such datasets. We provide a comprehensive survey of advances in high-dimensional data visualization that focuses on the past decade....","Shusen Liu,Dan Maljovec,Bei Wang,Peer-Timo Bremer,Valerio Pascucci,",https://ieeexplore.ieee.org/document/7784854/
2017,No Sessions,2016 Reviewers List,No Abstract,,https://ieeexplore.ieee.orgNo doi
2017,No Sessions,State of the Journal,No Abstract,"Leila De Floriani,",https://ieeexplore.ieee.org/document/7801956/
2017,No Sessions,A 3D Steganalytic Algorithm and Steganalysis-Resistant Watermarking,"We propose a simple yet efficient steganalytic algorithm for watermarks embedded by two state-of-the-art 3D watermarking algorithms by Cho et al. The main observation is that while in a clean model the means/variances of Cho et al.’s normalized histogram bins are expected to follow a Gaussian distribution, in a marked model their distribution will be bimodal. The proposed algorithm estimates the n...","Ying Yang,Ruggero Pintus,Holly Rushmeier,Ioannis Ivrissimtzis,",https://ieeexplore.ieee.org/document/7399411/
2017,No Sessions,Comprehensive Modeling and Visualization of Cardiac Anatomy and Physiology from CT Imaging and Computer Simulations,"In clinical cardiology, both anatomy and physiology are needed to diagnose cardiac pathologies. CT imaging and computer simulations provide valuable and complementary data for this purpose. However, it remains challenging to gain useful information from the large amount of high-dimensional diverse data. The current tools are not adequately integrated to visualize anatomic and physiologic data from...","Guanglei Xiong,Peng Sun,Haoyin Zhou,Seongmin Ha,Bríain ó Hartaigh,Quynh A. Truong,James K. Min,",https://ieeexplore.ieee.org/document/7399768/
2017,No Sessions,Deformable Model-Based Methods for Shape Control of a Haptic Jamming Surface,"Haptic Jamming, the approach of simultaneously controlling mechanical properties and surface deformation of a tactile display via particle jamming and pneumatics, shows promise as a tangible, shape-changing human-computer interface. Previous research introduced device design and described the force-displacement interactions for individual jamming cells. The work in this article analyzes the shape ...","Andrew A. Stanley,Allison M. Okamura,",https://ieeexplore.ieee.org/document/7399409/
2017,No Sessions,Fauxvea: Crowdsourcing Gaze Location Estimates for Visualization Analysis Tasks,"We present the design and evaluation of a method for estimating gaze locations during the analysis of static visualizations using crowdsourcing. Understanding gaze patterns is helpful for evaluating visualizations and user behaviors, but traditional eye-tracking studies require specialized hardware and local users. To avoid these constraints, we developed a method called Fauxvea, which crowdsource...","Steven R. Gomez,Radu Jianu,Ryan Cabeen,Hua Guo,David H. Laidlaw,",https://ieeexplore.ieee.org/document/7414495/
2017,No Sessions,Flip to Regular Triangulation and Convex Hull,"Flip is a simple and local operation to transform one triangulation to another. It makes changes only to some neighboring simplices, without considering any attribute or configuration global in nature to the triangulation. Thanks to this characteristic, several flips can be independently applied to different small, non-overlapping regions of one triangulation. Such operation is favored when design...","Mingcen Gao,Thanh-Tung Cao,Tiow-Seng Tan,",https://ieeexplore.ieee.org/document/7406755/
