year,session,title,abstract,author,doi
2012,No Sessions,Point-Based Manifold Harmonics,"This paper proposes an algorithm to build a set of orthogonal Point-Based Manifold Harmonic Bases (PB-MHB) for spectral analysis over point-sampled manifold surfaces. To ensure that PB-MHB are orthogonal to each other, it is necessary to have symmetrizable discrete Laplace-Beltrami Operator (LBO) over the surfaces. Existing converging discrete LBO for point clouds, as proposed by Belkin et al. [CH...","Yang Liu,Balakrishnan Prabhakaran,Xiaohu Guo,",https://ieeexplore.ieee.org/document/6264046/
2012,No Sessions,Enhancing the Symmetry and Proportion of 3D Face Geometry,"We present an engine for enhancing the geometry of a 3D face mesh model while making the enhanced version share close similarity with the original. After obtaining the feature points of a given scanned 3D face model, we first perform a local and global symmetrization on the key facial features. We then apply an overall proportion optimization to the frontal face based on Neoclassical Canons and go...","Qiqi Liao,Xiaogang Jin,Wenting Zeng,",https://ieeexplore.ieee.org/document/6143936/
2012,No Sessions,Design of 2D Time-Varying Vector Fields,"Design of time-varying vector fields, i.e., vector fields that can change over time, has a wide variety of important applications in computer graphics. Existing vector field design techniques do not address time-varying vector fields. In this paper, we present a framework for the design of time-varying vector fields, both for planar domains as well as manifold surfaces. Our system supports the cre...","Guoning Chen,Vivek Kwatra,Li-Yi Wei,Charles D. Hansen,Eugene Zhang,",https://ieeexplore.ieee.org/document/6112753/
2012,No Sessions,Feature-Driven Data Exploration for Volumetric Rendering,"We have developed an intuitive method to semiautomatically explore volumetric data in a focus-region-guided or value-driven way using a user-defined ray through the 3D volume and contour lines in the region of interest. After selecting a point of interest from a 2D perspective, which defines a ray through the 3D volume, our method provides analytical tools to assist in narrowing the region of inte...","Insoo Woo,Ross Maciejewski,Kelly P. Gaither,David S. Ebert,",https://ieeexplore.ieee.org/document/6143934/
2012,No Sessions,Interest Driven Navigation in Visualization,"This paper describes a new method to explore and discover within a large data set. We apply techniques from preference elicitation to automatically identify data elements that are of potential interest to the viewer. These ""elements of interest (EOI)” are bundled into spatially local clusters, and connected together to form a graph. The graph is used to build camera paths that allow viewers to ""to...","Christopher G. Healey,Brent M. Dennis,",https://ieeexplore.ieee.org/document/6133283/
2012,No Sessions,Parallel Computation of 2D Morse-Smale Complexes,The Morse-Smale complex is a useful topological data structure for the analysis and visualization of scalar data. This paper describes an algorithm that processes all mesh elements of the domain in parallel to compute the Morse-Smale complex of large 2D datasets at interactive speeds. We employ a reformulation of the Morse-Smale complex using Forman's Discrete Morse Theory and achieve scalability ...,"Nithin Shivashankar,Senthilnathan M,Vijay Natarajan,",https://ieeexplore.ieee.org/document/6104039/
2012,No Sessions,Fisheye Video Correction,"Various types of video can be captured with fisheye lenses; their wide field of view is particularly suited to surveillance video. However, fisheye lenses introduce distortion, and this changes as objects in the scene move, making fisheye video difficult to interpret. Current still fisheye image correction methods are either limited to small angles of view, or are strongly content dependent, and t...","Jin Wei,Chen-Feng Li,Shi-Min Hu,Ralph R. Martin,Chiew-Lan Tai,",https://ieeexplore.ieee.org/document/5963663/
2012,No Sessions,Variational Blue Noise Sampling,"Blue noise point sampling is one of the core algorithms in computer graphics. In this paper, we present a new and versatile variational framework for generating point distributions with high-quality blue noise characteristics while precisely adapting to given density functions. Different from previous approaches based on discrete settings of capacity-constrained Voronoi tessellation, we cast the b...","Zhonggui Chen,Zhan Yuan,Yi-King Choi,Ligang Liu,Wenping Wang,",https://ieeexplore.ieee.org/document/6197186/
2012,No Sessions,[Inside back cover],No Abstract,,https://ieeexplore.ieee.orgNo doi
2012,No Sessions,[Back cover],No Abstract,,https://ieeexplore.ieee.orgNo doi
2012,No Sessions,[Front cover],No Abstract,,https://ieeexplore.ieee.orgNo doi
2012,No Sessions,[Inside front cover],No Abstract,,https://ieeexplore.ieee.orgNo doi
2012,No Sessions,Guest Editor's Introduction: Special Section on the IEEE Pacific Visualization Symposium,No Abstract,"Giuseppe Di Battista,Jean-Daniel Fekete,Huamin Qu,",https://ieeexplore.ieee.org/document/6238452/
2012,No Sessions,Flow Visualization with Quantified Spatial and Temporal Errors Using Edge Maps,"Robust analysis of vector fields has been established as an important tool for deriving insights from the complex systems these fields model. Traditional analysis and visualization techniques rely primarily on computing streamlines through numerical integration. The inherent numerical errors of such approaches are usually ignored, leading to inconsistencies that cause unreliable visualizations and...","Harsh Bhatia,Shreeraj Jadhav,Peer-Timo Bremer,Guoning Chen,Joshua A. Levine,Luis Gustavo Nonato,Valerio Pascucci,",https://ieeexplore.ieee.org/document/6051431/
2012,No Sessions,Scalable Multivariate Volume Visualization and Analysis Based on Dimension Projection and Parallel Coordinates,"In this paper, we present an effective and scalable system for multivariate volume data visualization and analysis with a novel transfer function interface design that tightly couples parallel coordinates plots (PCP) and MDS-based dimension projection plots. In our system, the PCP visualizes the data distribution of each variate (dimension) and the MDS plots project features. They are integrated s...","Hanqi Guo,He Xiao,Xiaoru Yuan,",https://ieeexplore.ieee.org/document/6171180/
2012,No Sessions,WORDGRAPH: Keyword-in-Context Visualization for NETSPEAK's Wildcard Search,"The WORDGRAPH helps writers in visually choosing phrases while writing a text. It checks for the commonness of phrases and allows for the retrieval of alternatives by means of wildcard queries. To support such queries, we implement a scalable retrieval engine, which returns high-quality results within milliseconds using a probabilistic retrieval strategy. The results are displayed as WORDGRAPH vis...","Patrick Riehmann,Henning Gruendl,Martin Potthast,Martin Trenkmann,Benno Stein,Bernd Froehlich,",https://ieeexplore.ieee.org/document/6175895/
2012,No Sessions,Visualizing Dynamic Data with Maps,"Maps offer a familiar way to present geographic data (continents, countries), and additional information (topography, geology), can be displayed with the help of contours and heat-map overlays. In this paper, we consider visualizing large-scale dynamic relational data by taking advantage of the geographic map metaphor. We describe a map-based visualization system which uses animation to convey dyn...","Daisuke Mashima,Stephen Kobourov,Yifan Hu,",https://ieeexplore.ieee.org/document/6109250/
2012,No Sessions,Combining Single and Packet-Ray Tracing for Arbitrary Ray Distributions on the Intel MIC Architecture,"Wide-SIMD hardware is power and area efficient, but it is challenging to efficiently map ray tracing algorithms to such hardware especially when the rays are incoherent. The two most commonly used schemes are either packet tracing, or relying on a separate traversal stack for each SIMD lane. Both work great for coherent rays, but suffer when rays are incoherent: The former experiences a dramatic l...","Carsten Benthin,Ingo Wald,Sven Woop,Manfred Ernst,William R. Mark,",https://ieeexplore.ieee.org/document/6081859/
2012,No Sessions,Handling Motion-Blur in 3D Tracking and Rendering for Augmented Reality,"The contribution of this paper is two-fold. First, we show how to extend the ESM algorithm to handle motion blur in 3D object tracking. ESM is a powerful algorithm for template matching-based tracking, but it can fail under motion blur. We introduce an image formation model that explicitly consider the possibility of blur, and shows its results in a generalization of the original ESM algorithm. Th...","Youngmin Park,Vincent Lepetit,Woontack Woo,",https://ieeexplore.ieee.org/document/6025351/
2012,No Sessions,A Curvature-Adaptive Implicit Surface Reconstruction for Irregularly Spaced Points,A curvature-adaptive implicit surface reconstruction for noisy and irregularly spaced points in 3D is introduced. The reconstructed surface traces the zero crossings of a signed field obtained from the sum of first-derivative anisotropic Gaussians centered at the points. The standard deviations of the anisotropic Gaussians are adapted to surface curvatures estimated from local data. A key characte...,"Lyubomir G. Zagorchev,Arthur Ardeshir Goshtasby,",https://ieeexplore.ieee.org/document/6081858/
2012,No Sessions,Uniform B-Spline Curve Interpolation with Prescribed Tangent and Curvature Vectors,"This paper presents a geometric algorithm for the generation of uniform cubic B-spline curves interpolating a sequence of data points under tangent and curvature vectors constraints. To satisfy these constraints, knot insertion is used to generate additional control points which are progressively repositioned using corresponding geometric rules. Compared to existing schemes, our approach is capabl...","Shoichi Okaniwa,Ahmad Nasri,Hongwei Lin,Abdulwahed Abbas,Yuki Kineri,Takashi Maekawa,",https://ieeexplore.ieee.org/document/6035703/
2012,No Sessions,Baroclinic Turbulence with Varying Density and Temperature,"The explosive or volcanic scenes in motion pictures involve complex turbulent flow as its temperature and density vary in space. To simulate this turbulent flow of an inhomogeneous fluid, we propose a simple and efficient framework. Instead of explicitly computing the complex motion of this fluid dynamical instability, we first approximate the average motion of the fluid. Then, the high-resolution...","Doyub Kim,Seung Woo Lee,Oh-young Song,Hyeong-Seok Ko,",https://ieeexplore.ieee.org/document/6042858/
2012,No Sessions,Social-Event-Driven Camera Control for Multicharacter Animations,"In a virtual world, a group of virtual characters can interact with each other, and these characters may leave a group to join another. The interaction among individuals and groups often produces interesting events in a sequence of animation. The goal of this paper is to discover social events involving mutual interactions or group activities in multicharacter animations and automatically plan a s...","I-Cheng Yeh,Wen-Chieh Lin,Tong-Yee Lee,Hsin-Ju Han,Jehee Lee,Manmyung Kim,",https://ieeexplore.ieee.org/document/6065732/
2012,No Sessions,Facial Performance Transfer via Deformable Models and Parametric Correspondence,"The issue of transferring facial performance from one person's face to another's has been an area of interest for the movie industry and the computer graphics community for quite some time. In recent years, deformable face models, such as the Active Appearance Model (AAM), have made it possible to track and synthesize faces in real time. Not surprisingly, deformable face model-based approaches for...","Akshay Asthana,Miles de la Hunty,Abhinav Dhall,Roland Goecke,",https://ieeexplore.ieee.org/document/6025350/
2012,No Sessions,Empirical Studies in Information Visualization: Seven Scenarios,"We take a new, scenario-based look at evaluation in information visualization. Our seven scenarios, evaluating visual data analysis and reasoning, evaluating user performance, evaluating user experience, evaluating environments and work practices, evaluating communication through visualization, evaluating visualization algorithms, and evaluating collaborative data analysis were derived through an ...","Heidi Lam,Enrico Bertini,Petra Isenberg,Catherine Plaisant,Sheelagh Carpendale,",https://ieeexplore.ieee.org/document/6095544/
2012,No Sessions,Simplification of Node Position Data ;for Interactive Visualization of Dynamic Data Sets,We propose to aid the interactive visualization of time-varying spatial data sets by simplifying node position data over the entire simulation as opposed to over individual states. Our approach is based on two observations. The first observation is that the trajectory of some nodes can be approximated well without recording the position of the node for every state. The second observation is that t...,"Paul Rosen,Voicu Popescu,",https://ieeexplore.ieee.org/document/6060816/
2012,No Sessions,Direct Feature Visualization Using Morse-Smale Complexes,"In this paper, we characterize the range of features that can be extracted from an Morse-Smale complex and describe a unified query language to extract them. We provide a visual dictionary to guide users when defining features in terms of these queries. We demonstrate our topology-rich visualization pipeline in a tool that interactively queries the MS complex to extract features at multiple resolu...","Attila Gyulassy,Natallia Kotava,Mark Kim,Charles D. Hansen,Hans Hagen,Valerio Pascucci,",https://ieeexplore.ieee.org/document/6065731/
2012,No Sessions,Efficient Computation of Combinatorial Feature Flow Fields,"We propose a combinatorial algorithm to track critical points of 2D time-dependent scalar fields. Existing tracking algorithms such as Feature Flow Fields apply numerical schemes utilizing derivatives of the data, which makes them prone to noise and involve a large number of computational parameters. In contrast, our method is robust against noise since it does not require derivatives, interpolati...","Jan Reininghaus,Jens Kasten,Tino Weinkauf,Ingrid Hotz,",https://ieeexplore.ieee.org/document/6060947/
2012,No Sessions,Multimodal Data Fusion Based on Mutual Information,"Multimodal visualization aims at fusing different data sets so that the resulting combination provides more information and understanding to the user. To achieve this aim, we propose a new information-theoretic approach that automatically selects the most informative voxels from two volume data sets. Our fusion criteria are based on the information channel created between the two input data sets t...","Roger Bramon,Imma Boada,Anton Bardera,Joaquim Rodriguez,Miquel Feixas,Josep Puig,Mateu Sbert,",https://ieeexplore.ieee.org/document/6095545/
2012,No Sessions,VisWeek 2012,No Abstract,,https://ieeexplore.ieee.org/document/6238453/
2012,No Sessions,[Inside back cover],No Abstract,,https://ieeexplore.ieee.orgNo doi
2012,No Sessions,[Back cover],No Abstract,,https://ieeexplore.ieee.orgNo doi
2012,No Sessions,[Front cover],No Abstract,,https://ieeexplore.ieee.orgNo doi
2012,No Sessions,[Inside front cover],No Abstract,,https://ieeexplore.ieee.orgNo doi
2012,No Sessions,Guest Editor's Introduction: Special Section on the ACM SIGGRAPH/Eurographics Symposium on Computer Animation (SCA),No Abstract,"Adam W. Bargteil,Michiel van de Panne,",https://ieeexplore.ieee.org/document/6214952/
2012,No Sessions,A Multigrid Fluid Pressure Solver Handling Separating Solid Boundary Conditions,We present a multigrid method for solving the linear complementarity problem (LCP) resulting from discretizing the Poisson equation subject to separating solid boundary conditions in an Eulerian liquid simulation's pressure projection step. The method requires only a few small changes to a multigrid solver for linear systems. Our generalized solver is fast enough to handle 3D liquid simulations wi...,"Nuttapong Chentanez,Matthias Mueller-Fischer,",https://ieeexplore.ieee.org/document/6171181/
2012,No Sessions,Preserving Fluid Sheets with Adaptively Sampled Anisotropic Particles,"This paper presents a particle-based model for preserving fluid sheets of animated liquids with an adaptively sampled Fluid-Implicit-Particle (FLIP) method. In our method, we preserve fluid sheets by filling the breaking sheets with particle splitting in the thin regions, and by collapsing them in the deep water. To identify the critically thin parts, we compute the anisotropy of the particle neig...","Ryoichi Ando,Nils Thurey,Reiji Tsuruno,",https://ieeexplore.ieee.org/document/6171182/
2012,No Sessions,Detail-Preserving Controllable Deformation from Sparse Examples,"Recent advances in laser scanning technology have made it possible to faithfully scan a real object with tiny geometric details, such as pores and wrinkles. However, a faithful digital model should not only capture static details of the real counterpart but also be able to reproduce the deformed versions of such details. In this paper, we develop a data-driven model that has two components; the fi...","Haoda Huang,KangKang Yin,Ling Zhao,Yue Qi,Yizhou Yu,Xin Tong,",https://ieeexplore.ieee.org/document/6171183/
2012,No Sessions,Physics-Based Character Skinning Using Multidomain Subspace Deformations,"In this extended version of our Symposium on Computer Animation paper, we describe a domain-decomposition method to simulate articulated deformable characters entirely within a subspace framework. We have added a parallelization and eigendecomposition performance analysis, and several additional examples to the original symposium version. The method supports quasistatic and dynamic deformations, n...","Theodore Kim,Doug L. James,",https://ieeexplore.ieee.org/document/6165281/
2012,No Sessions,Robust Interactive Collision Handling between Tools and Thin Volumetric Objects,"Treating the interactions of soft tissue with rigid user-guided tools is a difficult problem. This is particularly true if the soft tissue has a slender shape, i.e., resembling a thin shell, and if the underlying numerical time-integration scheme employs large time steps. In this case, large mutual displacements of both the tool and the soft tissue occur frequently, resulting in deep interpenetrat...","Jonas Spillmann,Matthias Harders,",https://ieeexplore.ieee.org/document/6200365/
2012,No Sessions,Inference-Based Surface Reconstruction of Cluttered Environments,"We present an inference-based surface reconstruction algorithm that is capable of identifying objects of interest among a cluttered scene, and reconstructing solid model representations even in the presence of occluded surfaces. Our proposed approach incorporates a predictive modeling framework that uses a set of user-provided models for prior knowledge, and applies this knowledge to the iterative...","Keith Biggers,John Keyser,",https://ieeexplore.ieee.org/document/6035704/
2012,No Sessions,Robust Dense Registration of Partial Nonrigid Shapes,"This paper presents a complete and robust solution for dense registration of partial nonrigid shapes. Its novel contributions are founded upon the newly proposed heat kernel coordinates (HKCs) that can accurately position points on the shape, and the priority-vicinity search that ensures geometric compatibility during the registration. HKCs index points by computing heat kernels from multiple sour...","Tingbo Hou,Hong Qin,",https://ieeexplore.ieee.org/document/6060815/
2012,No Sessions,A Deformable Surface Model for Real-Time Water Drop Animation,"A water drop behaves differently from a large water body because of its strong viscosity and surface tension under the small scale. Surface tension causes the motion of a water drop to be largely determined by its boundary surface. Meanwhile, viscosity makes the interior of a water drop less relevant to its motion, as the smooth velocity field can be well approximated by an interpolation of the ve...","Yizhong Zhang,Huamin Wang,Shuai Wang,Yiying Tong,Kun Zhou,",https://ieeexplore.ieee.org/document/5999663/
2012,No Sessions,Spherical DCB-Spline Surfaces with Hierarchical and Adaptive Knot Insertion,"This paper develops a novel surface fitting scheme for automatically reconstructing a genus-0 object into a continuous parametric spline surface. A key contribution for making such a fitting method both practical and accurate is our spherical generalization of the Delaunay configuration B-spline (DCB-spline), a new non-tensor-product spline. In this framework, we efficiently compute Delaunay confi...","Juan Cao,Xin Li,Zhonggui Chen,Hong Qin,",https://ieeexplore.ieee.org/document/6025349/
2012,No Sessions,Dot Scissor: A Single-Click Interface for Mesh Segmentation,"This paper presents a very easy-to-use interactive tool, which we call dot scissor, for mesh segmentation. The user's effort is reduced to placing only a single click where a cut is desired. Such a simple interface is made possible by a directional search strategy supported by a concavity-aware harmonic field and a robust voting scheme that selects the best isoline as the cut. With a concavity-awa...","Youyi Zheng,Chiew-Lan Tai,Oscar Kin-Chung Au,",https://ieeexplore.ieee.org/document/5989803/
2012,No Sessions,A Survey of Visualization Systems for Network Security,"Security Visualization is a very young term. It expresses the idea that common visualization techniques have been designed for use cases that are not supportive of security-related data, demanding novel techniques fine tuned for the purpose of thorough analysis. Significant amount of work has been published in this area, but little work has been done to study this emerging visualization discipline...","Hadi Shiravi,Ali Shiravi,Ali A. Ghorbani,",https://ieeexplore.ieee.org/document/6007132/
2012,No Sessions,Coherent Time-Varying Graph Drawing with Multifocus+Context Interaction,"We present a new approach for time-varying graph drawing that achieves both spatiotemporal coherence and multifocus+context visualization in a single framework. Our approach utilizes existing graph layout algorithms to produce the initial graph layout, and formulates the problem of generating coherent time-varying graph visualization with the focus+context capability as a specially tailored deform...","Kun-Chuan Feng,Chaoli Wang,Han-Wei Shen,Tong-Yee Lee,",https://ieeexplore.ieee.org/document/5963661/
2012,No Sessions,Using Aging to Visually Uncover Evolutionary Processes on Networks,"Networks are widely used to describe many natural and technological systems. Understanding how these evolve over time poses a challenge for existing visualization techniques originally developed for fixed network structures. We describe a method of incorporating the concept of aging into evolving networks, where nodes and edges store information related to the amount of local evolutionary change t...","Thomas E. Gorochowski,Mario di Bernardo,Claire S. Grierson,",https://ieeexplore.ieee.org/document/5999664/
2012,No Sessions,Hierarchical Streamline Bundles,"Effective 3D streamline placement and visualization play an essential role in many science and engineering disciplines. The main challenge for effective streamline visualization lies in seed placement, i.e., where to drop seeds and how many seeds should be placed. Seeding too many or too few streamlines may not reveal flow features and patterns either because it easily leads to visual clutter in r...","Hongfeng Yu,Chaoli Wang,Ching-Kuang Shene,Jacqueline H. Chen,",https://ieeexplore.ieee.org/document/6025348/
2012,No Sessions,Interactive Computation and Rendering of Finite-Time Lyapunov Exponent Fields,"In this paper, we present a novel technique that allows for the coupled computation and visualization of salient flow structures at interactive frame rates. Our approach is built upon a hierarchical representation of the Finite-time Lyapunov Exponent (FTLE) field, which is adaptively sampled and rendered to meet the need of the current visual setting. The performance of our method allows the user ...","samer barakat,Christoph Garth,Xavier Tricoche,",https://ieeexplore.ieee.org/document/6143942/
2012,No Sessions,[Inside back cover],No Abstract,,https://ieeexplore.ieee.orgNo doi
2012,No Sessions,[Back cover],No Abstract,,https://ieeexplore.ieee.orgNo doi
2012,No Sessions,[Front cover],No Abstract,,https://ieeexplore.ieee.orgNo doi
2012,No Sessions,[Inside front cover],No Abstract,,https://ieeexplore.ieee.orgNo doi
2012,No Sessions,Guest Editors' Introduction: Special Section on the IEEE Virtual Reality Conference (VR),No Abstract,"Victoria Interrante,Benjamin C. Lok,Aditi Majumder,Michitaka Hirose,",https://ieeexplore.ieee.org/document/6200790/
2012,No Sessions,Modeling Object Pursuit for Desktop Virtual Reality,Models of interaction tasks are quantitative descriptions of relationships between human temporal performance and the spatial characteristics of the interactive tasks. Examples include Fitts' law for modeling the pointing task and Accot and Zhai's steering law for the path steering task. Interaction models can be used as guidelines to design efficient user interfaces and quantitatively evaluate in...,"Lei Liu,Robert Van Liere,",https://ieeexplore.ieee.org/document/6143941/
2012,No Sessions,Interactive Visibility Retargeting in VR Using Conformal Visualization,"In Virtual Reality, immersive systems such as the CAVE provide an important tool for the collaborative exploration of large 3D data. Unlike head-mounted displays, these systems are often only partially immersive due to space, access, or cost constraints. The resulting loss of visual information becomes a major obstacle for critical tasks that need to utilize the users' entire field of vision. We h...","Kaloian Petkov,Charilaos Papadopoulos,Min Zhang,Arie E. Kaufman,Xianfeng Gu,",https://ieeexplore.ieee.org/document/6086538/
